id	text	creation_time	user_loc
792932947909308416	@adirado29 @utopia4masses @GOP @HillaryClinton We're about to legalize weed. How many peeps you got in jail cause weed? Don't bring up CDN.	Mon Oct 31 03:35:21 +0000 2016	Bala, ON
792918475245285376	@Trey_Valeska @Aza_Roth @HillaryLostMe @donnabrazile yes and he decided to legalize weed now for the whole country in 2017	Mon Oct 31 02:37:50 +0000 2016	Toronto, ON, Canada
792670424882708480	United they stand for the legalization of #marijuana from lawn to lawn from here to there.… https://t.co/ebC9TCXBTw	Sun Oct 30 10:12:11 +0000 2016	Vancouver Island, BC
792223909995220992	Marijuana is going to get legal soon enough. One thing to look forward here.	Sat Oct 29 04:37:53 +0000 2016	Toronto
792155379320909825	An interesting question is which ones will sell the legal weed next year? https://t.co/H94c74GpJH	Sat Oct 29 00:05:34 +0000 2016	Ottawa
792137839962095616	How the actual he'll is this legal @BostonGlobe? Archdiocese to spend $850,000 against #marijuana legalization https://t.co/TJCdoV0R4e	Fri Oct 28 22:55:52 +0000 2016	Toronto
792072678878224384	LOL...voter fraud for Mayor = $10,000 bond but voter fraud for legalization of weed = $125,000 bond. Interesting. https://t.co/lpnNmMnzXd	Fri Oct 28 18:36:57 +0000 2016	The Great White North
792037468145061888	Interesting takeaway in the public health discussion of marijuana legalization @picardonhealth https://t.co/QbMWDbKVHt	Fri Oct 28 16:17:02 +0000 2016	Toronto
792030800380174336	Legal #Marijuana Industry in Canada Will be Bigger Than Alcohol, Study Says https://t.co/hy2y9Ji21V #Cannabis #CdnHealth #hcsm https://t.co/hAAXGWeN8J	Fri Oct 28 15:50:32 +0000 2016	Vancouver, BC, Canada
791993911430508544	Canadiabs evenly split on Cannabis legalization: an important footnote to consider in the rush for the gate https://t.co/IGTPiWt0di	Fri Oct 28 13:23:57 +0000 2016	Halifax, Nova Scotia
791768477191241728	Confused about how to vote on PROP 64 pot legalization? First, get the facts straight- https://t.co/l5LcTWZx22	Thu Oct 27 22:28:09 +0000 2016	Toronto, Canada
791637651988238338	Christy Clark "thinks"? If so, why no BC legalization of opioid killing marijuana yet? @SensibleBC Why maintain lost drug war? #hypocrite https://t.co/tBYx5eCQ4c	Thu Oct 27 13:48:18 +0000 2016	Victoria, BC
791636872715988994	@GlobalBC @globalnews She thinks? If so, why no legalization of opioid killing marijuana yet? @SensibleBC Why maintain the losing drug war?	Thu Oct 27 13:45:13 +0000 2016	Victoria, BC
791509164358938624	The impact of legalization of marijuana on our youth. The challenges my colleagues face in Colorado. https://t.co/utd8wz3ZCk	Thu Oct 27 05:17:44 +0000 2016	Vancouver, Canada
791340065465077760	I'm #justsayin if weed were legal we'd have no debt, new jobs &amp; less crime. More:money_bag:4 social programs and the poor. @JustinTrudeau #Winnipeg	Wed Oct 26 18:05:48 +0000 2016	Winnipeg, Manitoba
790988295526354944	It's a funny world when Hell's Angels are protesting the legalization of marijuana and Shopper's Drug Mart wants to become pot distributor.	Tue Oct 25 18:48:00 +0000 2016	Toronto Canada
790966370284347392	@marketcall @AndrewBellBNN is CGC in sell mode or a long term hold? Thoughts on the marijuana legalization plan?	Tue Oct 25 17:20:52 +0000 2016	Toronto Canada
790959661033730048	I guess @scotiabank doesn't want to earn revenue off the largest growing segment in banking, #cannabis is legal and here to stay. Wake up! https://t.co/oqBLbZGqjo	Tue Oct 25 16:54:13 +0000 2016	Calgary Alberta Portland OR San Diego California
790939664722956289	Not a great couple of days (year?) for @JustinTrudeau...the youth he swayed with #marijuana legalization now booing re #Jobs loss. #cdnpoli	Tue Oct 25 15:34:45 +0000 2016	Calgary Alberta Portland OR San Diego California
790932957783584769	Hell yes! @ShopprsDrugMart taking their first step in legitimizing medical marijuana as a form of medication! #legalization #cdnpoli #weed https://t.co/p94YwKKuCz	Tue Oct 25 15:08:06 +0000 2016	Unsurrendered & Unceded Algonquin Territory
790909312096833537	Impaired driving laws continue to be speed bump in future marijuana legalization. https://t.co/Xa6VSmCG70	Tue Oct 25 13:34:09 +0000 2016	Edmonton, AB
790873300041814016	Find the smartest woman &amp; the smartest man, breed a super intelligent child who grows up, takes over the planet. Legal weed! #MyTwitterGoal	Tue Oct 25 11:11:03 +0000 2016	Winnipeg, Manitoba
790765341483765761	#Stigmabase USCA - Remember the start of the war to legalize marijuana - Not that Grant Krieger isn't feeling lost… https://t.co/R6UoaRPswU	Tue Oct 25 04:02:03 +0000 2016	America | United Kindom
790765125439553536	@findingwhitney time to legalize marijuana and get those repairs done	Tue Oct 25 04:01:12 +0000 2016	Brampton, Ontario
790715590134542337	Wonder if she tried the local produce? https://t.co/gcEebtFIfs	Tue Oct 25 00:44:22 +0000 2016	Spruce Grove, Albertastan.
790700452123848704	Marijuana wasn't 'cash cow' for Colorado, Alberta minister learns https://t.co/Qni6yaZibX	Mon Oct 24 23:44:12 +0000 2016	Calgary, AB
790661622046068739	@HuskerFox marijuana and marijuana legalization. I want some of that money the Americans are making. I think it's sad that we fell behind	Mon Oct 24 21:09:55 +0000 2016	Montréal, Québec
790540144705212416	@Bird5Ca also marijuana can be ingested or vaped, the benefits of legalization will out weigh any disadvantages	Mon Oct 24 13:07:12 +0000 2016	Montréal, Québec
790532421586259970	What You Need To Know About #Cannabis #Legalization - https://t.co/rdLCda92jM via @greenflwrmedia	Mon Oct 24 12:36:31 +0000 2016	Brockville, Ontario
790412375262363648	Here's our Monday Sun Media editorial: Legal pot: Easier said than done https://t.co/a5vh3eoKxM #cdnpoli #topoli #tocouncil #onpoli https://t.co/zfyXsa6msO	Mon Oct 24 04:39:30 +0000 2016	website:
790384270556688388	#legalization #cannabis #potstocks #marijuana #7Acres #prohibition #johnfowler is smokin hot! https://t.co/JizEuKm1NZ	Mon Oct 24 02:47:49 +0000 2016	Edmonton, Alberta
790248848333627392	@OccupyWallStNYC Trump will legalize pot.. https://t.co/zYZxKJLtBj	Sun Oct 23 17:49:42 +0000 2016	Edmonton, Alberta
789895890672709632	Inside big pharma's fight to block recreational marijuana https://t.co/UJ4JcHSPBA	Sat Oct 22 18:27:10 +0000 2016	Halifax, Nova Scotia
789797873022078976	Gallup poll: 60% of Americans support marijuana legalization: highest in history ahead of 2016 election. #marijuana https://t.co/zScDzMuuiP	Sat Oct 22 11:57:41 +0000 2016	Ottawa
789641634678005760	#cannabis #stock #legalization #marijuana # investing #pennystock https://t.co/R30NerBqqi	Sat Oct 22 01:36:51 +0000 2016	Edmonton, Alberta
789465818664800256	@roitweets poor choice of a headline, however; Record high 60 percent of Americans back legal pot, poll finds https://t.co/pwTpWr7eBr	Fri Oct 21 13:58:13 +0000 2016	Calgary & Muscat
789301610912555008	Here are All the U.S. Legislators Who Support Marijuana Legalization. Check Out the Full List! https://t.co/2OECkAp4L9 https://t.co/9h7KBLc4iH	Fri Oct 21 03:05:43 +0000 2016	Toronto, Canada
788914880116060160	@Yowan Trump wants to make pot legal..	Thu Oct 20 01:28:59 +0000 2016	Toronto, Canada
788851678095216640	GO FIGURE #BC and #Quebec #aren’t #using Canada’s #legal medical #marijuana #system. #WHY is this so #shocking??. https://t.co/QjTma5Vxa9 https://t.co/zOHmYKpGPX	Wed Oct 19 21:17:50 +0000 2016	Toronto, Canada
788816953594945536	You know it's 2016 on the @tsx_tsxv when a speculative legal marijuana security $CGC is up 300% https://t.co/eugVnDEyxJ	Wed Oct 19 18:59:51 +0000 2016	Toronto
788756294228381696	Alberta's Justice Minister and Solicitor General is Colorado-bound to see how the state has handled legal weed: https://t.co/nq9eG17qsC	Wed Oct 19 14:58:49 +0000 2016	London, Ontario
788752621502799872	@TheZone913 Biggest turn-offs for dating? My disability, the poverty I'm forced into by government, &amp; my LEGAL pain medication; marijuana.	Wed Oct 19 14:44:13 +0000 2016	Victoria, BC
788706013960691713	One year in and still no legal weed.	Wed Oct 19 11:39:01 +0000 2016	Ottawa
788701882231336963	One year since federal Liberals won the election! Don't forget the first anniversary gift is paper, or, once they legalize pot, papers	Wed Oct 19 11:22:36 +0000 2016	St. John's, NL
788563251365748736	Alberta justice minister plans pot policy research trip to Denver https://t.co/Aad5gQheve	Wed Oct 19 02:11:44 +0000 2016	Calgary, AB
788444942511251456	Legalization of #marijuana is coming, so how do we determine the sobriety of drivers? A test is needed #aptasummit @APTA_Trucking @CanTruck	Tue Oct 18 18:21:37 +0000 2016	Sackville, Nova Scotia
788410639525916672	Encouraging to see Canada learning from our friends in Colorado ahead of national legalization of #cannabis. https://t.co/ouWzHggTzU	Tue Oct 18 16:05:19 +0000 2016	Canada
788398581069864960	New poll is out: Where should we buy our pot once it’s legal? : https://t.co/5ovDP8Otod https://t.co/ABNWGy33Zk	Tue Oct 18 15:17:24 +0000 2016	Ottawa, Ontario, Canada
788391077887606784	READ: Why the government can’t charge more than $10 a gram for legal pot https://t.co/Ds9FtriptJ	Tue Oct 18 14:47:35 +0000 2016	Canada - Australia
788372086947319808	To really eliminate the black market, legal pot would have to be sold for under $10 a gram, experts says. https://t.co/HUAOAsAcuQ	Tue Oct 18 13:32:07 +0000 2016	Edmonton, AB
788306594299641856	Why pricing pot is a delicate issue. cdnpoli https://t.co/VzPvKEc6s5	Tue Oct 18 09:11:52 +0000 2016	Calgary, AB
788302116620083201	Why pricing pot is a delicate issue. cdnpoli https://t.co/Y6xhHrZuD6	Tue Oct 18 08:54:05 +0000 2016	Montreal, QC
788229520054636544	B.C. residents favour pot shops for legal marijuana sales: poll https://t.co/FNxd8QuIBA	Tue Oct 18 04:05:36 +0000 2016	Vancouver, BC
788204961838473217	@pivotlegal Raise the Rates while we debate! Maintaining Poverty while we strategize is like arresting potheads while we legalize #Marijuana	Tue Oct 18 02:28:01 +0000 2016	Victoria, BC
788129920878870528	LIVE!!! @GovJVentura tells us about his #legalize #marijuana book w/ @iamToddyTickles &amp; @milanmiracle @canadalaughs @siriusxmcanada #SXM168	Mon Oct 17 21:29:50 +0000 2016	Toronto - New York - LA
788126682209095680	Or did the government say they were gonna legalize weed to get voters :thinking_face: https://t.co/qi8K9TsmuA	Mon Oct 17 21:16:58 +0000 2016	Toronto - New York - LA
788122465008553984	Richard Branson to cannabis advocates: Fight to legalize it: https://t.co/kKHV4eMenw @richardbranson @Rickthelaureate @joerogan #cannabis	Mon Oct 17 21:00:12 +0000 2016	London, Ontario
788101799546716160	Y'all know that weed will never fully be legal in Canada :loudly_crying_face: we were sold lies	Mon Oct 17 19:38:05 +0000 2016	London, Ontario
787704039710429184	@JodieEmery its like the govt thinks there will be a million new pot smokers... peeps aren't going to start smoking pot just cuz its legal.	Sun Oct 16 17:17:32 +0000 2016	Vancouver BC
787684045622620160	'Park those biases and you stay objective': Colorado's advice to Canada on legal pot https://t.co/0sRdPX4ckL	Sun Oct 16 15:58:05 +0000 2016	Ottawa, ON
787666811835682816	Legal marijuana had little impact on public health Colorado Chf Med Officer tells Canada cdnpoli CDPHE Public… https://t.co/GxMrtF4I3W	Sun Oct 16 14:49:36 +0000 2016	Ottawa, ON
787637367851003905	.@globalnews confuses fucking moron for marijuana expert; publishes lies about Cannabis. #ReeferMadness @GlobalBC https://t.co/F7a3wWSMxp	Sun Oct 16 12:52:36 +0000 2016	Victoria, BC
787635751760515076	Pot legalization may roll back progress on tobacco, expert fears https://t.co/R75g2ptPsO	Sun Oct 16 12:46:11 +0000 2016	Edmonton, AB
787631457342672896	Pot legalization may roll back progress on tobacco, expert fears https://t.co/palJAYYWBr	Sun Oct 16 12:29:07 +0000 2016	Calgary, AB
787597227371868160	'Park those biases': Colorado's advice to Canada on legal pot https://t.co/5b2njegpDr	Sun Oct 16 10:13:06 +0000 2016	Ottawa, ON
787308968448290816	Liberals are looking for excuses to not legalize pot because in actuality they are very conservative. #cdnpoli https://t.co/AWV8Av6HdD	Sat Oct 15 15:07:40 +0000 2016	Howe Island
787283127563542529	Trudeau's Faux-Feminism similar to Faux Marijuana Legalization; Does @JustinTrudeau have a spine? #cannabis #Trump https://t.co/6ml7RRwihX	Sat Oct 15 13:24:59 +0000 2016	Victoria, BC
787086663793061890	The DEA continuing, supporting, and stoking the war on drugs, as usual https://t.co/I7ToH201c7 via @nbcnews	Sat Oct 15 00:24:18 +0000 2016	Edmonton, Alberta
787060300629487616	Safeguarding Medical Cannabis as Legalization Unfolds @JohnConroyMMAR Robert W. E. Laurie @KirkTousaw @IntlCBC #ICBCVAN #Vancouver https://t.co/sezYjY4aAR	Fri Oct 14 22:39:33 +0000 2016	Vancouver, BC
787020495673696256	Great panel on Legalization in Canada at ICBC in Vancouver @IntlCBC #ICBCVAN with @HempAce @jamiesashaw @KirkTousaw @dmacpher #cannabis https://t.co/Z28YqBTWWI	Fri Oct 14 20:01:22 +0000 2016	Vancouver, BC
787018050516111361	Absurd to think this would work: Minimum age for legal marijuana should be 25, according to Ottawa Public Health https://t.co/YXuuA9lNq7	Fri Oct 14 19:51:39 +0000 2016	Toronto
786939166198149120	How medical pot sellers plan to prevent their businesses from going up in smoke https://t.co/ynpi603Klj	Fri Oct 14 14:38:12 +0000 2016	Edmonton, AB
786929639432204288	The @OttawaCitizen -How #Ottawa's health unit says we should legalize marijuana. #scleroderma https://t.co/PYghD0X3Qi https://t.co/Rmvk6sjWz1	Fri Oct 14 14:00:21 +0000 2016	Canada
786724673698410496	#Cannabis legalization works. Prohibition is a failed and harmful policy. #nomoredrugwar #legalizeit #LegalizedIt https://t.co/cvIL0P7cvz	Fri Oct 14 00:25:53 +0000 2016	Portland, Oregon
786630806919794688	What does the CEO of pot producer @tilray think about pot legalization? Our Facebook video: #OCannabis @VancouverSun https://t.co/yQyeJs9jzH	Thu Oct 13 18:12:53 +0000 2016	Vancouver
786620261873311744	'Stoner' Tommy Chong says Canada's pot legislation could set example for U.S. https://t.co/QUgrzqEm1W	Thu Oct 13 17:30:59 +0000 2016	Ottawa
786613490458820608	'Stoner' Tommy Chong thinks the US could learn from Canadian pot laws. https://t.co/3TXGSVLyrO	Thu Oct 13 17:04:05 +0000 2016	Vancouver, BC
786603655340232704	Ace says make sure you have enough cannabis products to wait out the West Coast storms #FreeCannabis #Legalize https://t.co/G0XU3FtvqX	Thu Oct 13 16:25:00 +0000 2016	Sooke, B.C. Canada
786588110851182593	Support for #marijuana legalization rises among U.S. adults: poll https://t.co/PBgzMnIZ7h #Cannabis #LegalizeIt #pharma	Thu Oct 13 15:23:14 +0000 2016	Vancouver, BC, Canada
786556336603406338	#Thurds Like many her age, she wanted cheap, legal marijuana, but the vote gerrymandering meant to achieve that end also triggered a loss.	Thu Oct 13 13:16:58 +0000 2016	Toronto, Canada
786375802979889152	Will you smoke pot when it becomes legal? cdnpoli https://t.co/FWhihIP2G8	Thu Oct 13 01:19:36 +0000 2016	Montreal, QC
786363748969684992	* @Global_Montreal No, but I am in favor of the full legalization of #marijuana for those who do smoke it, especially for medical purposes.	Thu Oct 13 00:31:42 +0000 2016	Soviet Canuckistan
786319334914322432	Cannabis conversations are important as we move forward with legalization.	Wed Oct 12 21:35:13 +0000 2016	Soviet Canuckistan
786287689972736001	@eye_on_CBs Minimum age for legal marijuana should be 25, according to Ottawa Public Health https://t.co/yXe3WSf650	Wed Oct 12 19:29:28 +0000 2016	Halifax, Nova Scotia
786279871265640452	Funky video by my colleague @yeshe on the future of medicinal pot for our Canada-with-legal-weed series. #ocannabis https://t.co/kGvE1idcPW https://t.co/Rsb85HE1ty	Wed Oct 12 18:58:24 +0000 2016	Vancouver
786252440005857280	My #OCannabis contributions include how legalization might crush small growers &amp; what US investors see in Canada: https://t.co/M0SJTBYbg2	Wed Oct 12 17:09:24 +0000 2016	Vancouver, BC
786251807454482432	#OCannabis, a @nationalpost series, is here. @PostmediaNews reporters probed what legalization means for the nation. https://t.co/X8emDow9gf	Wed Oct 12 17:06:53 +0000 2016	Vancouver, BC
786249832767721472	Like pot? Hate pot? Regardless, it will be legal soon in Canada. Find out what you need to know. #OCannabis https://t.co/kGvE1idcPW	Wed Oct 12 16:59:02 +0000 2016	Vancouver
786189051543949313	If "legal" pot in Cnd only available to 25+? Guarantees black market. so MJ arrests, prison sentences, will continue apace.	Wed Oct 12 12:57:31 +0000 2016	Moscow, Russia
785963153095925760	Shots fired at legal marijuana grow operation in Uxbridge, Ontario https://t.co/a1SvC4sWDT via @metronews	Tue Oct 11 21:59:52 +0000 2016	Kawartha Lakes
785681669151870977	@jssgriffi hey we have a PM who promised to legalize weed, he's taking his time on that one lol	Tue Oct 11 03:21:21 +0000 2016	Brampton, Ontario
785466899438063616	Yo @TorontoPolice you need to get your act together. Charging dispensaries? Possession? For Marijuana? When yall know it bout to be legal.	Mon Oct 10 13:07:56 +0000 2016	Toronto Canada
785409957126508544	How will legal pot be sold? Three things that might happen, and one that won't https://t.co/WBNGFkeP4c #cdnpoli #bcpoli #vanpoli	Mon Oct 10 09:21:40 +0000 2016	Vancouver, BC
785337918680334336	@eye_on_CBs How will legal pot be sold? Three things that might happen, and one that won’t https://t.co/9UPREBXPbj	Mon Oct 10 04:35:25 +0000 2016	Halifax, Nova Scotia
785088828885184513	How will legal pot be sold? Three things that might happen, and one that won't https://t.co/AZ4txhA2Wu	Sun Oct 09 12:05:37 +0000 2016	Montreal, QC
785088819850731521	How will legal pot be sold? Three things that might happen, and one that won't https://t.co/uYAbfJwBEs	Sun Oct 09 12:05:35 +0000 2016	Edmonton, AB
785084668148187136	How will legal pot be sold? Three things that might happen, and one that won't https://t.co/gLYGR7BRx1	Sun Oct 09 11:49:05 +0000 2016	Calgary, AB
785015471493959683	MWUSCA - Has Colorado teen marijuana use not increased since legalization? - We should also note that the anti-pot… https://t.co/yoaQZrcAwX	Sun Oct 09 07:14:07 +0000 2016	America | United Kindom
784918711949942784	MWUSCA - Has Colorado teen marijuana use not increased since legalization? - We should also note that the anti-pot… https://t.co/5w4WaIAvBC	Sun Oct 09 00:49:38 +0000 2016	America | United Kindom
784570602841669633	@respectinc @KevinDarryl The #Libertarian Party is hurting the #Cannabis legalization cause Voting #ThirdParty will only enthrone #Trump	Sat Oct 08 01:46:22 +0000 2016	Toronto, Ontario
858509738807635970	@Lafond66 It will be legal in Canada by next summer https://t.co/JMNUZCp8dA ... so weird that it's so taboo in USA	Sun Apr 30 02:34:06 +0000 2017	Canada
858420144141459457	when weed becomes legal there's going to be so many confused german shepards	Sat Apr 29 20:38:05 +0000 2017	716
858134095574032385	@McLovin_Yeg Lol, and keep busting pot dispensaries even tho you're going to make it legal	Sat Apr 29 01:41:26 +0000 2017	Canada
857929780825440256	Canada's justice system is unequal, and legal pot isn't helping, writes Supriya Dwivedi https://t.co/1ggobmxr9r	Fri Apr 28 12:09:33 +0000 2017	Edmonton, AB
857622018207825920	Where medical marijuana is legal, illegal use climbs https://t.co/U62cHF0yNx #cannabis #teenhealth #pharma	Thu Apr 27 15:46:37 +0000 2017	Vancouver, BC, Canada
857617153482145792	Honoured to have my father present at the Alberta Chiefs meeting about legalization of marijuana and concerns for Police in the workplace https://t.co/ABTYcPkdHh	Thu Apr 27 15:27:17 +0000 2017	Medicine Hat, AB
857348378203635712	When will weed legalization take place? #legalize #420 #hightimes https://t.co/iWguJ0PACC	Wed Apr 26 21:39:16 +0000 2017	Vancouver BC
857317876616843265	My people know how to grow the BEST cannabis. There better be some Black runned LPs there when it becomes legal man lol	Wed Apr 26 19:38:04 +0000 2017	Toronto, Ontario
857249693000122372	Accuracy of pot impairment tests questioned ahead of legalization #cdnpoli https://t.co/90L6PtSdyx	Wed Apr 26 15:07:08 +0000 2017	Calgary #yyc #yyccentre
857241531996045312	This is true. If the gov't wants to legalize cannabis, the need to add clemency for existing drug charges https://t.co/XLmyjJE2vq	Wed Apr 26 14:34:42 +0000 2017	True North Strong & Free 🇨🇦
857066095072518144	The amount of weed I smelled walking outside the lineup for the weekend concert, was concerning. It's still shocking to me that it's legal.	Wed Apr 26 02:57:35 +0000 2017	Winnipeg, Manitoba
857040185325887489	#Nanaimo marijuana producer likes legalization legislation. https://t.co/rU2w4I7y9m	Wed Apr 26 01:14:37 +0000 2017	YCD
856997069512482816	.@BillBlair says pardons for cannabis possesion charges can't be considered until after legalization &amp;new system of control in place #PnPcbc	Tue Apr 25 22:23:18 +0000 2017	Ottawa, Ontario, Canada
856971096809062400	Meanwhile, for Canadians heading to the U.S., having a marijuana arrest on your record can get you barred for life. https://t.co/XuWtSdQag3	Tue Apr 25 20:40:05 +0000 2017	Edmonton, AB
856941161579020288	After pot, legalize heroin Via @CDCofBC #opioid #pharma #paincontrol https://t.co/mGtthMIzlt	Tue Apr 25 18:41:08 +0000 2017	Vancouver, BC, Canada
856907581348085760	Why does @JustinTrudeau insist decriminalizing pot possession would legalize distribution? It just isn't true. https://t.co/Gg7V7gWgWd	Tue Apr 25 16:27:42 +0000 2017	Scarborough, Ontario
856839033393209344	@Pain_In_Grass I put 'legal' in scare quotes because there will still be criminal sanctions for some cannabis related activities.	Tue Apr 25 11:55:19 +0000 2017	Moscow, Russia
856838746569920512	@Pain_In_Grass Theoretically the Senate can veto a bill, but it rarely happens. https://t.co/BjU9ECzhdO So marijuana will be 'legal' in Canada.	Tue Apr 25 11:54:11 +0000 2017	Moscow, Russia
856684983154593792	Ah, to be a one percenter..."his father's resources, legal network and connections helped make the charge "go away," https://t.co/PBCFFNa7WI	Tue Apr 25 01:43:11 +0000 2017	Canada
856679320965828608	So PET used his legal connections to make sure there was one standard for his son, and another for everyone else? https://t.co/JNMCLmd27k	Tue Apr 25 01:20:41 +0000 2017	London, England
856676886247866369	@JustinTrudeau @JustinTrudeau is hoping Canadians are high when the 2019 election arrives. One reason to legalize marijuana	Tue Apr 25 01:11:00 +0000 2017	Oakville. Ontario Canada
856659087089573888	:high_voltage:️ “Justin Trudeau joined VICE to talk marijuana legalization” https://t.co/9IytO3nBrQ	Tue Apr 25 00:00:16 +0000 2017	Vancouver Canada
856643922885586944	Cannabis: a public health menace aid for opioid abusers?:high_voltage: Justin Trudeau joins VICE to talk marijuana legalization https://t.co/QzTUEnaqEA	Mon Apr 24 23:00:01 +0000 2017	Kitchener, Ontario
856633925132800001	The leftvis having trouble getting welfare recipients to vote. They're hoping this will do what pot legalization did for Trudeau. https://t.co/pHOOC97jkq	Mon Apr 24 22:20:17 +0000 2017	Harrow, Ontario
856583485275987969	For sure though, a LOT of stuff associated with "legal" marijuana will still be 'illegal' thus ensuring work for cops, crowns and prisons.	Mon Apr 24 18:59:52 +0000 2017	Moscow, Russia
856542910648426496	This should be read by anyone interested in legalization in Canada and how the process is unfolding. https://t.co/FiT614yKqL	Mon Apr 24 16:18:38 +0000 2017	Victoria BC
856534603800203266	Great talk regarding the regulation of Cannabis #RUTalksCannabis #Cannabis #Legalization #BillC45 https://t.co/4Enx6QSQE9	Mon Apr 24 15:45:37 +0000 2017	Toronto, Ontario
856370620912762882	@ipoliticsca What a great perspective on cannabis legalization- only missing o going medical need https://t.co/yOtYCESFAC	Mon Apr 24 04:54:01 +0000 2017	Toronto, ON
856332195752943616	@vicecanada @JustinTrudeau Court delays are letting violent criminals walk free, how does he justify the continued arrests of pot people when he plans to legalize?	Mon Apr 24 02:21:20 +0000 2017	Vancouver, B.C. Canada
856317591031296001	@AndreeaBelmont We need to send letters to put members of parliament telling them that we need legal dank weed for Twilight purposes	Mon Apr 24 01:23:17 +0000 2017	Yharnam
856277599663902720	Very sobering program on CBC about pot legalization in WA &amp; CO. God help us all.https://t.co/v81CHzyA6t	Sun Apr 23 22:44:23 +0000 2017	Mississauga, Ontario, Canada
856161464691949570	When weed is legal, weed ads are banned. While still illegal, are weed ads ok? Is @pattisonoutdoor offside? @JustinTrudeau? https://t.co/nRsxJEKaow	Sun Apr 23 15:02:54 +0000 2017	NYC and TO
855948083909214208	Damage Caused by Alcohol Can't Be Fixed :skull_and_crossbones:️ #DrunkDriving #Violence #HeartDisease :skull_and_crossbones:️ #legalize #marijuana #cannabis:seedling: https://t.co/BAwCNvXvZC	Sun Apr 23 00:55:00 +0000 2017	Victoria, BC
855928212391702529	Thanks for the #420 shout out 5440ontour You rock! #5440 #5440ontour #cannabis #legalize… https://t.co/6t6EyeuDkJ	Sat Apr 22 23:36:02 +0000 2017	Vancouver, BC
855896889295646720	Dr. Gail Beck: Legal age for #cannabis use should be higher, not lower https://t.co/mvo2eHMjg5 #pharma #hcldr	Sat Apr 22 21:31:34 +0000 2017	Vancouver, BC, Canada
855891299991527425	Yes @LouiseMensch don't call on us again ok? I know weed is legal now here in :Canada:, but with good conscience we can't supply you any more. https://t.co/tqgM4cdCH2	Sat Apr 22 21:09:22 +0000 2017	Toronto, ON, Canada
855889534621450241	@jessejane did you know that Canada :Canada: is making weed legal on July 1 in 2018	Sat Apr 22 21:02:21 +0000 2017	Toronto, ON, Canada
