id	text	creation_time	user_loc
808841017931788288	@wizkhalifa when weed is legal in Canada is that KK gonna be getting here?	Wed Dec 14 01:08:20 +0000 2016	6️⃣ | canada
808810223368601600	Finally! 30grms limit is not bad cant wait for it to be legalized! Pot task force releases report https://t.co/6801Nzh6Ll	Tue Dec 13 23:05:58 +0000 2016	Toronto, Canada
808802986671546368	Congratulations ... you're a visionary, not a criminal! Task force announcement just in time for Christmas #legalize #cannabis #kush	Tue Dec 13 22:37:13 +0000 2016	1625 Quadra Street Victoria BC
808802290282983424	@simbris Don't forget #weed. It will be legal by spring, 2017 in Canada. So we can get high but at least in the US can't quit smoking.	Tue Dec 13 22:34:27 +0000 2016	Nova Scotia, Canada
808800708019580929	What am I reading :face_with_tears_of_joy::pistol: very good fast legalize , :high_voltage:️ “Ottawa urged to make pot legal at age 18” https://t.co/jwxu15JOes	Tue Dec 13 22:28:10 +0000 2016	Old trafford 
808761422867996672	Pot task force recommends legal cannabis sales be limited to users &gt;18.https://t.co/s1yRivrWKJ. Ganja for health &amp; happiness? Make it legal!	Tue Dec 13 19:52:03 +0000 2016	Old trafford 
808759102151266304	@globalnews One thing for sure, pot industry taxes will always be high:face_with_tears_of_joy: #Canada #legalization #pot #taxes #stoned	Tue Dec 13 19:42:50 +0000 2016	Etobicoke,ON,CANADA
808755812231364608	The govt has #cannabis #legalization meticulously planned. task force made sure not to cause a frenzy on the market the way it was written.	Tue Dec 13 19:29:46 +0000 2016	Edmonton, Alberta
808753303001722881	Marijuana is legal. Why cant I get #Justin his father &amp; this Christmas Carol out of my head "And A POTHEAD in a Pierre Tree" @AnitaSharma	Tue Dec 13 19:19:48 +0000 2016	Canada
808752646551203840	Marijuana is legal. Why cant I get #JUSTIN his father &amp; this Christmas Carol out of my head "And A Pothead in a Pierre Tree" @brianlilley ?	Tue Dec 13 19:17:11 +0000 2016	Canada
808746847669993472	:high_voltage:️ “Ottawa urged to make pot legal at age 18” https://t.co/8utnECLSWD	Tue Dec 13 18:54:08 +0000 2016	Frying yam
808740358691487744	Never read beyond the executive summary - Framework for pot legalization: https://t.co/JHf2zB9ndr	Tue Dec 13 18:28:21 +0000 2016	Greater Vancouver
808726740952444928	Minimum age, plain packaging: Federal task force releases recommendations on how best to legalize marijuana. https://t.co/MKLxJJWVr7	Tue Dec 13 17:34:15 +0000 2016	Vancouver, BC
808722860474765312	#Canadian #Pot task force recommends legal #cannabis sales be limited to users 18 and over Fam needed a win!! https://t.co/B1nEnCRHDL	Tue Dec 13 17:18:49 +0000 2016	Brockville, Ontario
808718722353471488	Do you support #legalization ? #AnneMcLellan #cannabis #marijuana #CannabisRevolution #tocouncil #cdnpoli #pnpcbc	Tue Dec 13 17:02:23 +0000 2016	Bayview Woods-Steeles, Toronto
808718230973882368	"Now is the time to move away from a system that has been focused on the prohibition of cannabis into a regulated legal market."#taskforce	Tue Dec 13 17:00:26 +0000 2016	Vancouver, BC
808717129302282240	Pot task force recommends legal age of 18 - lower than alcohol. Do you agree? @am640 416 870 6400 1230pm https://t.co/2alQlSEZsh	Tue Dec 13 16:56:03 +0000 2016	Toronto
808713625879752704	Federal task force advises wide-ranging legalization of recreational marijuana in Canada :maple_leaf: https://t.co/qcPVt1L1d3 https://t.co/wsXbgkFJJd	Tue Dec 13 16:42:08 +0000 2016	            No music, no life.
808708510590631938	Pot task force recommends legal cannabis sales be limited to users over 18 https://t.co/yWdj57NgNO	Tue Dec 13 16:21:48 +0000 2016	St.Catharines Ontario Canada
808707416246386688	#Cannabis Task Force recommendations are in &amp; legislation legalizing cannabis to be tabled spring 2017 #cndpoli https://t.co/v8ey5Q93R4	Tue Dec 13 16:17:27 +0000 2016	Toronto, Ontario
808706730863509504	Pot task force recommends legalisation for age 18+, extra fees for higher THC and a ban on selling at liquor stores https://t.co/1tdBBAa6sb	Tue Dec 13 16:14:44 +0000 2016	Kitchener, Ontario
808706463338262528	Today: Trump and Kanye have a meeting &amp; Canadians discuss how to properly legalize marijuana. 2016 is weird.	Tue Dec 13 16:13:40 +0000 2016	Halifax, Nova Scotia
808704944442343424	Federal task force advises wide-ranging legalization of recreational marijuana /via @danlebla #cdnpoli https://t.co/muZ1drE1we?	Tue Dec 13 16:07:38 +0000 2016	Ottawa
808703692182589440	@JodieEmery @ProfDanBear Bla bla bla. In the meantime, have you secured a legal source of your #Cannabis from the likes of $CGC.TO, etc.?	Tue Dec 13 16:02:39 +0000 2016	Planet Drunk
808701329438834689	Took a long time but that’s a solid list of recommendations for Canada’s pot legalization https://t.co/PerRjXecfv	Tue Dec 13 15:53:16 +0000 2016	Ottawa, Ontario, Canada
808701217052459009	Marijuana legalization is 1 step closer. This is a great step toward putting safeguards in our communities. The illicit market is dangerous.	Tue Dec 13 15:52:49 +0000 2016	Red Deer, Alberta
808700786616266756	Also recommends that legal age should be 18, unless individual province's want later age https://t.co/NSwkj5LjGp #NB	Tue Dec 13 15:51:07 +0000 2016	Ottawa, Ontario
808462176193310720	@lifeschoices79 Keeps saying legal weed is to protect youth. But that's nonsense. None of it's rational. I think the US is after him on this	Tue Dec 13 00:02:57 +0000 2016	Moscow, Russia
808443998025240576	First look tomorrow am at Task Force on #Cannabis Legalization and Regulation document! Could send $CGC.CA, $SL.CA, $MJN.CA, soaring. https://t.co/ltGqsA14HA	Mon Dec 12 22:50:43 +0000 2016	Toronto, ON
808399150073057280	I also sort of worry now that legalization won't lower prices of cannabis plants. The govt will want to put a stupid amount of tax on it. :confused_face:	Mon Dec 12 19:52:31 +0000 2016	Montréal, Québec, Canada
808385924409290752	@EmmaJaeBlue True! And those are not traditionally considered "youth issues" ie marijuana legalization, tuition...	Mon Dec 12 18:59:58 +0000 2016	Canada
808342054623412225	@muddywolfking @theslimdude Call me craazy but to me, "legal marijuana" looks just like legal coffee.	Mon Dec 12 16:05:38 +0000 2016	Moscow, Russia
808333333545500672	I'd ask, "who will be the last person arrested for pot in Canada" But for sure in his legal regime, ppl will still get caged for marijuana.	Mon Dec 12 15:30:59 +0000 2016	Moscow, Russia
808330146935607297	@katbellavanilla Try Point Roberts USA. Marijuana is legal there, just saying. ;-)	Mon Dec 12 15:18:19 +0000 2016	Moncton 
807685956589363201	The homie Nate Diaz after finding weed is legal in cali https://t.co/AYJLT3QN7n	Sat Dec 10 20:38:32 +0000 2016	Moncton 
807460003493855232	There's been no bait-and-switch on #cannabis #legalization, by @jennav5 https://t.co/9WYoga098o via @HuffPostCanada	Sat Dec 10 05:40:41 +0000 2016	Brockville, Ontario
807358579443437568	The biggest mistake of Libs in lead up 2 legalization has certainly been the continued enforcement of cannabis laws.https://t.co/S76pHUB1ug	Fri Dec 09 22:57:39 +0000 2016	Canada
807275419993075712	There's Been No Bait-And-Switch On #Cannabis Legalization https://t.co/fMBzdbxoXU via @jennav5	Fri Dec 09 17:27:13 +0000 2016	Toronto, Canada
807269659552649218	Legalize pot for more answers like this:beaming_face_with_smiling_eyes: https://t.co/4WvIKssq4i	Fri Dec 09 17:04:19 +0000 2016	Toronto, Canada
806876422937530368	"Let me get this straight. In order to keep the drug out of the hands of children we are going to first legalize it" https://t.co/8sQxr25CoC	Thu Dec 08 15:01:44 +0000 2016	Toronto, Ontario
806861224688386052	@Andyn305 no telling with Trump but I am hopeful this is not a priority/would take too much political capital https://t.co/c7nkhEblZ9	Thu Dec 08 14:01:21 +0000 2016	Montréal, Québec
806848645052174336	Ottawa must monitor how legal pot could hurt and help: experts /via @globeandmail https://t.co/bRfyZZf5QP	Thu Dec 08 13:11:22 +0000 2016	Toronto, ON
806735091443433472	Cam Battley chats with Out in the Open #rules #acmpr https://t.co/9x3SPLZIm0	Thu Dec 08 05:40:08 +0000 2016	Edmonton, AB
806649480372109314	@PaigeVBA daaaaaaamn and weed ain't even legal yet!!!	Wed Dec 07 23:59:57 +0000 2016	Toronto, Beeton, Burlington..
806497038254809089	@JustinTrudeau Do the Xmas lights make it easier to see and criminalize non-corporate marijuana people? #cannabis #legalize #decriminalize	Wed Dec 07 13:54:12 +0000 2016	Victoria, BC
806356485886328832	Why are #Alaskan #authorities so #determined to #destroy this #woman’s life #over now-#legal #marijuana? https://t.co/JSwWGiDJ5I https://t.co/I1yZUrfrb0	Wed Dec 07 04:35:42 +0000 2016	Toronto, Canada
806296174411952128	@JustinTrudeau You lied about Cannabis legalization, you lied about protecting the environment... I call your BULLSHIT!!! #lameassPM	Wed Dec 07 00:36:02 +0000 2016	Vancouver BC
806173677813317632	Trudeau - Openly admitting to using marijuana is legal? had control of the marijuana knew the marijuana was there https://t.co/efwIDge5ux	Tue Dec 06 16:29:17 +0000 2016	Alberta, Canada
806163742375354368	Completely unrelated to pot legalization. Total coincidence it just happened to be a $420 increase :face_with_tears_of_joy::OK_hand: https://t.co/g2fkd8teyU	Tue Dec 06 15:49:48 +0000 2016	Canada
806131012682055680	@DisguiseDevilin I have no problem with pot being legal/alcohol is much worse	Tue Dec 06 13:39:45 +0000 2016	Canada
806032361070600192	@JustinTrudeau STOLE ELECTION VOTES FROM #NDP and #GREENS by LYING about PROTECTING THE ENVIRONMENT and LEGALIZATION OF CANNABIS.	Tue Dec 06 07:07:44 +0000 2016	Vancouver BC
805944248017289220	Really a pot store down the street is this even legal @HamiltonPolice @FredEisenberger	Tue Dec 06 01:17:37 +0000 2016	Hamilton, Ontario Canada
805766542172553216	@JustinTrudeau How about you just legalize Marijuana and let the cops go after real criminals instead of sick and in pain Canadians?	Mon Dec 05 13:31:28 +0000 2016	Sol 3, Milky Way.
805617213310832640	@JustinTrudeau I canvassed all around westwood plateau for the @liberal_party on broken fucking leg! When the fuck is LEGAL POT COMING?	Mon Dec 05 03:38:05 +0000 2016	Vancouver BC
805616670274306048	@JustinTrudeau I'm a cannabis concentrate producer. I don't want to grow pot. When can I buy 10 pounds of LEGAL CANNABIS as a raw material?	Mon Dec 05 03:35:56 +0000 2016	Vancouver BC
805616275154055169	Why is @JustinTrudeau ruining peoples lives... Canadians voted for legalization of cannabis which means a LEGAL thriving INDUSTRY.	Mon Dec 05 03:34:22 +0000 2016	Vancouver BC
805575967267844100	This is very disturbing, Trudeau encouraging the police to go out and cage as many as possible prior to legalization https://t.co/mH9GRGpDkF	Mon Dec 05 00:54:12 +0000 2016	Moscow, Russia
805521155478196224	@cjalbinati @checkupcbc no worry they'll legalize pot... or will they? ;) #cdnpoli	Sun Dec 04 21:16:23 +0000 2016	Gatineau, Québec
805260557053882369	Panel says Canada’s legal marijuana regime should be geared toward getting rid of the $7billion-a year black market. https://t.co/YlVt3gkhfp	Sun Dec 04 04:00:52 +0000 2016	Alberta, Canada
805258067046760448	Shit or get off the pot! Pardon the pun..Pot should be DECRIMINALIZED if you don't hurry up and legalize it! https://t.co/HOo1DdFea4	Sun Dec 04 03:50:58 +0000 2016	Canada
805207839371313153	"...And 2, to remove the criminal elements that were profiting from marijuana," #legalization #cdnpoli https://t.co/4G0Hsv8XQc	Sun Dec 04 00:31:23 +0000 2016	Edmonton, AB
804917567366320128	America really needs to legalize weed tho this show just proves how much time is being wasted by cops everyday #livepd	Sat Dec 03 05:17:57 +0000 2016	Edmonton, AB
804879244882886656	Since they have legal pot in Colorado.... why isn't The Rocky Mountain way better than the way we had????? #LifesBeenGood https://t.co/7kFNxdBZek	Sat Dec 03 02:45:40 +0000 2016	where the pucks are
804527607874289664	Mark my words. If you cannot grow your own it's not #Legalization #acmpr #LegalizeCanada #cdnpoli #cannabis	Fri Dec 02 03:28:23 +0000 2016	Spruce Grove, Albertastan.
784488575920316416	F**K YOU McLellan #MARIJUANA DOESN'T CAUSE CANCER, it cures; how do YOU not know this? @DalChancellor @JustinTrudeau https://t.co/GmQGmatT22	Fri Oct 07 20:20:26 +0000 2016	Victoria, BC
784486781341175808	I will be thankful when cannabis is a legal option. Studies are showing it can be more effective than opiates for pain management. https://t.co/Nd0uO4OyPj	Fri Oct 07 20:13:18 +0000 2016	Calgary, Alberta
784477129278750720	@Cinnamon305 @HumanistPundit Not really. Hillary is very liberal. Pot is becoming legal all over US. But it won't under dictator Trump.	Fri Oct 07 19:34:57 +0000 2016	California, USA
784463954034593792	.@JustinTrudeau admires Oktoberfest Booze-In celebration of world's most deadly drug. #legalize #marijuana #cannabis https://t.co/vi1drQhfK9	Fri Oct 07 18:42:35 +0000 2016	Victoria, BC
784395532504403968	Getting refollowed on instagram from numerous canadian cannabis placesWhy does IG shut down legal marijuana sites? This is canada it's legal	Fri Oct 07 14:10:42 +0000 2016	Calgary Alberta Portland OR San Diego California
784257999330168832	#Stigmabase USCA - Has Colorado teen marijuana use not increased since legalization? - We should also note that… https://t.co/5wtVC80n15	Fri Oct 07 05:04:12 +0000 2016	America | United Kindom
783453924321665024	I wish weed was legal in Canada so I could go for smoke breaks	Tue Oct 04 23:49:06 +0000 2016	yeg
783383529971417088	Don't forget promise to legalize pot biggest plank in promises. https://t.co/0bqBAyQuHv	Tue Oct 04 19:09:22 +0000 2016	Edmonton Alberta Canada
783285270192001024	@RosieBarton @AaronWherry @JustinTrudeau promised #Canada to legalize #marijuana, instead he delivers legalized 'high' #CarbonTax #cdnpoli	Tue Oct 04 12:38:55 +0000 2016	Edmonton Alberta Canada
783104151081279488	From zoning bylaws to policing, Ottawa prepares for the new world of legal pot https://t.co/vXsqPLSuE3	Tue Oct 04 00:39:13 +0000 2016	Ottawa, ON
783044132428255236	Legalizing pot will violate international treaties: What should Canada do? https://t.co/VetzbyWGzu	Mon Oct 03 20:40:44 +0000 2016	The third planet from the sun
782968982802497538	Legalizing pot will violate international treaties https://t.co/IZDemP0qBI A total non-issue. I can't believe how much press it has gotten.	Mon Oct 03 15:42:07 +0000 2016	Toronto
782951255681314816	Legalizing pot will violate international treaties: What should Canada do? cdnpoli https://t.co/T4yMJwWIDB	Mon Oct 03 14:31:40 +0000 2016	Ottawa, ON
782890351296180224	New @CBCNews article interviewing me on what Canada should do about international drug control treaties @uocommonlaw https://t.co/lIfAQ8011U	Mon Oct 03 10:29:39 +0000 2016	Toronto, Ontario
782646317747142656	@JustinTrudeau yo if you legalize weed can we start growing hemp fields rather than trees?? Look it up it good. Thanks dad	Sun Oct 02 18:19:57 +0000 2016	Toronto, Ontario
782441080960626688	@billmaher @HillaryClinton either she needs to promise legal weed, or people just hate diplomats and people who outsmart them #murica	Sun Oct 02 04:44:25 +0000 2016	Burnaby, Canada
826574062876909568	AFM outlines position on pot legalization https://t.co/6jAd0UcXoJ	Tue Jan 31 23:33:08 +0000 2017	Winnipeg, MB
826572056603013126	@thomjeff @susanholt @jupia I wonder if US states with legal pot have stats on the effect it had on liquor sales, if any	Tue Jan 31 23:25:09 +0000 2017	fredericton
826455533347434496	@liftcannabis Don't be foolish; marijuana legalization will ALWAYS be flawed if delayed seeking perfection. DECRIMINALIZE NOW @JodieEmery	Tue Jan 31 15:42:08 +0000 2017	Victoria, BC
826454637121122304	Cannabis Legalization will ALWAYS be flawed if delayed seeking perfection. DECRIMINALIZE NOW; STOP MARIJUANA ARRESTS https://t.co/mB7YonzN5c	Tue Jan 31 15:38:34 +0000 2017	Victoria, BC
826437708214059008	:sun:️The #Senate of #Canada will be discussing some aspects of #Cannabis #legalization TODAY January 31 Stay tuned :exclamation_mark::Canada::white_heavy_check_mark: https://t.co/qA5VyrpvCH	Tue Jan 31 14:31:18 +0000 2017	Québec, Canada
826423445391077377	Yeh derb green pot shatter is legal I small turtle vernekolis RCMP bike rider	Tue Jan 31 13:34:38 +0000 2017	Québec, Canada
826230330784821249	that’s like if you’re trying to make medicinal marijuana legal (which i support) and your argument is “it cures cancer”	Tue Jan 31 00:47:16 +0000 2017	Vancouver, British Columbia
826131374851637248	Some good news this week! Pot legal in Maine! #legalizeit #freetheweed https://t.co/PXZXAkuloX	Mon Jan 30 18:14:03 +0000 2017	Fort Lauderdale, FL
825888522083065856	Man I would deal with so much more bullshit in this country if only weed were legal	Mon Jan 30 02:09:02 +0000 2017	An Igloo
825883437135335425	don't forget about making weed legal https://t.co/sSLZA5d72t	Mon Jan 30 01:48:50 +0000 2017	An Igloo
825867066406293505	Wow. UnBElievable! Protesters - feed them legal pot brownies to mellow their aggression. They need to chill &amp; study the Constitution https://t.co/gDt06L0rjg	Mon Jan 30 00:43:47 +0000 2017	An Igloo
825781349155901441	California looking to build $7B legal pot economy https://t.co/akFF9JF2Rj	Sun Jan 29 19:03:10 +0000 2017	Calgary, AB
825370746352447490	Hey, @JustinTrudeau, got call fm @liberal_party saying pot won't be legalized til 2019! Why did @janephilpott lie? https://t.co/VAQsWDLfqT	Sat Jan 28 15:51:35 +0000 2017	Berwick, Nova Scotia, Canada
825368467872288768	Bring in more refugees, legalize pot, guaranteed minimum income. Not Buzzfeed headlines for “destroying” Trump in tweets	Sat Jan 28 15:42:32 +0000 2017	Ottawa
824755156986130432	Hey @simcoehh check out this company https://t.co/TaormNBK1W and their upcoming confeeence is March 10th. https://t.co/GSO6lrzyYx	Thu Jan 26 23:05:27 +0000 2017	Calgary, Alberta
824702311771602944	TRUDEAU promised legal weed. 2yrs later still very illegal. My city just RAIDED the few that are up. Now, they have paperwork on thousands https://t.co/uu3JOGF3AG	Thu Jan 26 19:35:28 +0000 2017	parents basement
824688229467041792	@bshynk @JustinTrudeau Appealing to his "legalize marijuana" voting demographic. #shrewd	Thu Jan 26 18:39:30 +0000 2017	Saskatoon
824608391507181568	@justinvl O’Leary is pro gay marriage, pro pot legalization, pro euthanasia, and has said nothing about Islam or immigrants.	Thu Jan 26 13:22:15 +0000 2017	Ottawa
824429078010822656	@TheTorontoSun @anthonyfurey pot is legal	Thu Jan 26 01:29:44 +0000 2017	Toronto, Ontario
824414318267600896	@BreitbartNews Elected as a protest vote after 10 years of Tory gov't. He promised to legalize pot &amp; Only got 39% of the 60% who voted.	Thu Jan 26 00:31:05 +0000 2017	Ottawa, Ontario
824362275926470656	@realDonaldTrump Legalize drugs: #cocaine, #heroin, #marijuana and you won't need a wall or as many police = $$$ @TeamTrump :) https://t.co/iNjYfNjC0j	Wed Jan 25 21:04:17 +0000 2017	Edmonton, AB, Canada
824325227987533836	Could contraband tobacco be a lesson for the government on getting marijuana legalization correct? @ScottTalking https://t.co/rEAA4il2BS	Wed Jan 25 18:37:04 +0000 2017	Hamilton, Ontario
824181395639640064	As a nation slumbers waiting for legal marijuana https://t.co/aRtA4G5EwX	Wed Jan 25 09:05:31 +0000 2017	Edmonton Alberta Canada
824168334556020736	Of course they r waiting for legal marijuana. https://t.co/RKlmKcCgEa	Wed Jan 25 08:13:37 +0000 2017	Edmonton Alberta Canada
824098949380370432	Growing Marijuana instead of grass on any property u own, is now LEGAL lol :face_screaming_in_fear::face_with_tears_of_joy::waving_hand_medium-light_skin_tone: #fakenewsfromcanada	Wed Jan 25 03:37:55 +0000 2017	#LeafsNation 
824093171567235072	@can_climate_guy hahaha. They missed the last polls as they were stoned on Illegal Weed. imagine what will happen when pot is legal !!!	Wed Jan 25 03:14:57 +0000 2017	new glasgow
824038845939261440	Council adjourns mtg to get legal advice. WeeMedical rep says 'no evidence' of pot sales, &amp; product seized was for other sites #Chilliwack	Tue Jan 24 23:39:05 +0000 2017	Chilliwack, BC
823755971927359488	Why is circumcision legal but smoking pot is not??	Tue Jan 24 04:55:03 +0000 2017	Chilliwack, BC
823703206966370304	@CTVToronto @Janice_Golding @JustinTrudeau said he would legalize marijuana @liberal_party @CBCNews https://t.co/6aIQF6zhRj	Tue Jan 24 01:25:22 +0000 2017	Edmonton, AB, Canada
823701293474676736	Don't expect nationwide marijuana legalization under the Trump administration https://t.co/FUqrAKVY9w via @sai	Tue Jan 24 01:17:46 +0000 2017	Québec, Canada
823700279728205824	HACKING SCARLETT JOHANSSON AND MARIJUANA SHOULD BE LEGAL. I'M JUST KIDDING. IT'S NOT COOL. https://t.co/4nWitdPeci	Tue Jan 24 01:13:44 +0000 2017	Toronto, Ontario
823655550714081282	@LynnSosnoskie @TheCropGuy Just say your gonna legalize marijuana and ban GM crops and you will be a winner..	Mon Jan 23 22:16:00 +0000 2017	Nairn Ontario
823573642416189440	@CBCNews why @JustinTrudeau's broken promise to legalize marijuana is continuing to endanger the public.	Mon Jan 23 16:50:32 +0000 2017	Ottawa, Ontario
823426254036668419	I'm trying to grow some peppers this year in my backyard. Hopefully right next to my legal weed garden.	Mon Jan 23 07:04:52 +0000 2017	Toronto, Ontario
823273942320377856	Hey @JustinTrudeau , can you guys stop dicking around and legalize the fucking weed already. You can discuss who gets what money later.	Sun Jan 22 20:59:38 +0000 2017	Montréal, Québec
823244168600416258	Weed is 100% legal Worldwide now, so smoke em if you got em! #alternativefacts	Sun Jan 22 19:01:19 +0000 2017	Sol 3, Milky Way.
822924046077571073	@NEWS1130 @JustinTrudeau i disagree with pot being legal. Makes teens be more convinced to do it.	Sat Jan 21 21:49:16 +0000 2017	FV
822701681393577984	A sponsored tweet just urged me to invest in the legal marijuana industry in the U.S. #MakeAmericaHighAgain	Sat Jan 21 07:05:40 +0000 2017	Calgary, AB
822504220788215810	Once weed is legal. Remember not to vote for @JustinTrudeau again. He is guilty of making criminals out of pot smokers. #Cdnpoli #TOpoli	Fri Jan 20 18:01:02 +0000 2017	Hashtag city Planet Earth
822184177458024448	@much_insane Germany legalises cannabis for medicinal purposes (Reuters)// this might help lower any anger issues.. 2nd hand smoking (legal)	Thu Jan 19 20:49:18 +0000 2017	Toronto, On. Canada
822134398954807296	. @jackknox lays out the pot shop legal confusion as a result of hazy federal guidelines. https://t.co/ZbTjztUkKc	Thu Jan 19 17:31:29 +0000 2017	Victoria BC
822101496607055872	@CassieNeil I'm not against a carbon tax, it got pipelines approved (that first step is important). But I agree, legalize and tax pot.	Thu Jan 19 15:20:45 +0000 2017	YYC
821842308349890561	@Totally_Offside @theninjagreg Honour his promise to reform the election process. Legalize weed like he promised. Help First Nations like...	Wed Jan 18 22:10:50 +0000 2017	Alberta, Canada
821833890260086785	. @DrewBarnesMLA Are you for or against the legalization of marijuana? @MicheleOttawa @660NEWS	Wed Jan 18 21:37:23 +0000 2017	Medicine Hat, AB
821445653075214337	.@KTSinkovits bringing in Colorado Cannabis Chamber of Commerce March 16 to discuss best practices https://t.co/vU4FmN0CGX	Tue Jan 17 19:54:40 +0000 2017	Winnipeg, Manitoba
821425269542187008	@MattPMaurer lists a couple questions from the upcoming #cannabis legalization discussion with the Canadian Senate https://t.co/j2IdtetlbT	Tue Jan 17 18:33:40 +0000 2017	Canada
821413303637286912	I think the legalization of weed in canada will be the unexpected savior for the arts. Awakening the love of art. #arts #canada #150 #420	Tue Jan 17 17:46:07 +0000 2017	Calgary, Alberta
821024725790912512	@CTVNews Lafleur's Mental Impairment result of Hockey Injuries :skull_and_crossbones: BAN HOCKEY :prohibited: SAVE BRAINS - Legalize Brain-Healing Marijuana NOW #cannabis	Mon Jan 16 16:02:03 +0000 2017	Victoria, BC
821024431581429760	Lafleur's Mental Impairment result of Hockey Injuries :skull_and_crossbones: BAN HOCKEY :prohibited: SAVE BRAINS - Legalize Brain-Healing Marijuana NOW #cannabis #Trudeau https://t.co/x85wJSawSc	Mon Jan 16 16:00:53 +0000 2017	Victoria, BC
821005303567237120	Curious about the rights of employees using medical #marijuana ? Here are two legal opinions: https://t.co/Hwss4G6otD #ACMPR	Mon Jan 16 14:44:52 +0000 2017	Canada
820808928158052353	Future looks bright for Alberta’s commercial cannabis producers https://t.co/35HMenC6Jb #marijuana #legalization	Mon Jan 16 01:44:33 +0000 2017	Edmonton, Alberta
820295543758811137	Here's How Big Pharma is Battling Marijuana Legalization... https://t.co/e4HDId5zo9	Sat Jan 14 15:44:32 +0000 2017	Toronto, Canada
820265394405572609	It's an exciting time when our market grows 3x in a year. All before recreational legalization. https://t.co/btL3yWYndB #cannabis #ACMPR	Sat Jan 14 13:44:44 +0000 2017	Canada
820066980598136833	See how creative #cannabis users are#FreeCannabis #CraftCannabis #Legalize #Trudeau #AcesStash https://t.co/nT82uqhDMf	Sat Jan 14 00:36:18 +0000 2017	Sooke, B.C. Canada
820040626582487040	HACKING SCARLETT JOHANSSON'S PRIVATE PHOTOS AND SMOKING WEED SHOULD BE LEGAL. IT MAKES SENSE RIGHT ? :rolling_on_the_floor_laughing: https://t.co/3X7UCJ6byU	Fri Jan 13 22:51:35 +0000 2017	Toronto, Ontario
819867945144827907	@mfdltd @RCMPPEITraffic CBC now spells it with an "h", &amp; apparently it's the legal name: https://t.co/JPaaVIAHrM	Fri Jan 13 11:25:25 +0000 2017	Tea Hill, PEI, Canada
