id	text	creation_time	user_loc
999428899921711106	So it begins. The alcohol and pharmaceutical companies are not going to sit by and watch. They are both a powerful lobby group. The cannabis industry needs to stay solid and united. Pre and post legalization alike. https://t.co/MLV0zd4ZRH	Wed May 23 23:16:32 +0000 2018	Surrey, B.C.
999334099658657795	if i wanna protest for legal weed on my twitter then thats my biz . but if i do it ion radio and am asked not too then thats ' their ' time etc...u gotta pick your spots	Wed May 23 16:59:50 +0000 2018	Surrey, B.C.
999315242906800128	@Beehive_Journal @MikeMooreNL I hear he's changing his name to "Bud" and getting into the legal pot business	Wed May 23 15:44:54 +0000 2018	NL
999314107214872577	In defence of the VicPD, I've personally witnessed very fast police response times; when police investigate my LEGAL Street Photography, my prescribed LEGAL mobility aid &amp; my LEGAL (15+ yrs) medical marijuana. #cannabis Keeping #yyj safe from Bruce Dean for nearly 20 yrs. https://t.co/aIVlNS1zXD	Wed May 23 15:40:24 +0000 2018	Victoria, BC
999293312338022401	@Grampydenky That mouth piercing must be uncomfortable. What has smoking weed got to do with it? Soon it will be legal, better than booze. Live and let live is my motto. In politics, persona is everything. I have a tattoo, says Mark and Laurie. We are still married. LMAO.	Wed May 23 14:17:46 +0000 2018	Hamilton, Ontario, Canada
999223618818093056	Double use hi House . W is a double use . We is Vee Robby Roo -Scooby snacks - dab dab foo. Cannabis martinis a 100% legal . Arrest cops raiders . Mercury are tro Rade aliens stealing pot because they are pigs	Wed May 23 09:40:50 +0000 2018	Russia, OH
999156627528806401	When is weed legal?	Wed May 23 05:14:38 +0000 2018	#yyc Calgary Alberta
999096341589618689	So with marijuana becoming legal soon, should we have a "Rod Black puffing game"?	Wed May 23 01:15:04 +0000 2018	Canada
999048295317213190	@graniterad @stephen_taylor All the pot smokers waiting for full legalization like he promised in the election LOL	Tue May 22 22:04:09 +0000 2018	Toronto, Ontario, Canada
999045266048274433	@Andrea_Khanjin I’m asking all 3 parties 3 questions. 1 what would you do about unions being allowed personal information of people if their place of employment has 20% cards signed. 2 how would you handle health care funding and 3 you stance on legal weed? I await your reply	Tue May 22 21:52:07 +0000 2018	ontario
999045029921480710	@AnnHoggarth4BI I’m asking all 3 parties 3 questions. 1 what would you do about unions being allowed personal information of people if their place of employment has 20% cards signed. 2 how would you handle health care funding and 3 you stance on legal weed? I await your reply	Tue May 22 21:51:11 +0000 2018	ontario
999044702111399936	@BI_NDP I’m asking all 3 parties 3 questions. 1 what would you do about unions being allowed personal information of people if their place of employment has 20% cards signed. 2 how would you handle health care funding and 3 you stance on legal weed? I await your reply	Tue May 22 21:49:52 +0000 2018	ontario
998964484600451073	@OntLiberal Such a foolish and leading argument. Other jurisdictions have minor allotments of alcohol for sale in stores. We are not children liberalism is state motherhood. Will we all be do nothing pot heads with legal #cannibas #suckandblow argument @JIMrichards1010	Tue May 22 16:31:07 +0000 2018	ontario
998938732806987776	If you have questions about marijuana legalization and its impact on your workplace my partners @KvanbuskirkSJ &amp; @mattletson have answers! https://t.co/ZnNgx7MZFR	Tue May 22 14:48:47 +0000 2018	Saint John, NB, Canada
998882598289072130	@mojorisen531 Exactly. Go after the coke and meth and heroin idiots. Pot is safer than alcohol and it's legal ....sheesh	Tue May 22 11:05:44 +0000 2018	Toronto, Ontario
998882182482493440	@mojorisen531 Our Prime Minister fucked up. When he was campaigning, he said he would legalize pot. So we were all "YAY" what he should have done is decriminalize it first. People are still being busted for it which is really stupid	Tue May 22 11:04:05 +0000 2018	Toronto, Ontario
998878983658901506	@mojorisen531 So apparently it's about 6 weeks until pot is legal here. We'll see. Our government is fucking around on this. It took almost a year so they could figure out how much money they could make from it. Assholes lol	Tue May 22 10:51:22 +0000 2018	Toronto, Ontario
998746457275555840	@ABC @ThisWeekABC I think you folks need to legalize marijuana and clean your drinking water. Nut bars.....	Tue May 22 02:04:45 +0000 2018	Toronto, Ontario
998592353387474944	1/6 It's clear that the Trudeau gov't has made a strategic decision to campaign against Stephen Harper. And it makes sense. Think about it: when your signature accomplishment after three years in gov't is an ill-conceived plan to legalize pot, you can't exactly run on your record https://t.co/lBXr5qZYlX	Mon May 21 15:52:24 +0000 2018	Ottawa, Ontario
998474754574209025	@BLUEANGEL -- Where are you;? - Right Honorable Stephen Harper? --- Canadians &amp; Quebecers need you very urgently to protect them from the upcoming disasters that will be engendered by the legalization of marijuana...Alain Amzallag, https://t.co/lKrXHAsb2F., PhD.	Mon May 21 08:05:06 +0000 2018	Montreal
998401094723166210	@Dax_x98 Legalize weed but lets not pretend it is cuz It is a miracle Drug.I like to get high is OK	Mon May 21 03:12:25 +0000 2018	Montreal
998365966873612290	Cannabis shipped to your doorstep. Safe, legal legit. Tracking included Discreet. Toll free customer support. Ships from: Vancouver, BC Check us out: https://t.co/Qzkq19AyBV #sudbury #timmins #wawa #sault #northernontario #soolookout #dryden #muskoka	Mon May 21 00:52:49 +0000 2018	Greater Sudbury / Grand Sudbury, Ontario
998252462556434432	#IAdmirePeopleWho stand up for cannabis legalization, portray confidence instead of arrogance, and use Oxford commas.	Sun May 20 17:21:48 +0000 2018	Canada
998244525549142017	@Dongrant18 @cathmckenna @EcologyOttawa Are you people already smoking not yet legal weed? You are deluded Miss McKenna, truly deluded.	Sun May 20 16:50:16 +0000 2018	Calgary
998241026790703109	I’m as excited for legal weed as the next middle-class white girl who’d never get cited for possession anyway, but my actual favourite part of legalization has been explaining to my parents how drug paraphernalia works.	Sun May 20 16:36:21 +0000 2018	Medicine Hat, Alberta
998207505888104449	Great article in @TorontoSUNPromo featuring @JodieEmery which highlights the hypocrisy of Canada’s present approach to cannabis legalization. Our #CannabisAmnesty petition is linked at the end. https://t.co/EHGqu3amjc	Sun May 20 14:23:09 +0000 2018	Toronto
998165000828194816	Big weed: Why legalization isn't necessarily a boon for craft cannabis producers https://t.co/CBNDGn8U3p	Sun May 20 11:34:15 +0000 2018	Trois-Rivieres,Que.Canada
997928751089438720	@CBCNews @cbcsports Right. Just as pot becomes legal in Canada.	Sat May 19 19:55:29 +0000 2018	Vancouver, British Columbia
997905892417949696	Despite looming legalization, cannabis possession charges remain a reality https://t.co/071SEaggRv @CannabisAmnesty #CannabisAmnesty	Sat May 19 18:24:39 +0000 2018	Toronto
997871121700552704	@hmhadley We still have that. Come July 1, I will be able to buy weed at a dispensary. Prostitution is mostly legal. Codeine without a script. But I have to be protected from vodka.	Sat May 19 16:06:29 +0000 2018	Toronto, Ontario
997843268086923266	Thank you @nowtoronto for featuring our campaign @CannabisAmnesty. Why is the impact of cannabis criminalization on the lives hundreds of thousands of Canadians an afterthought? Pardons should be integrated into Bill #C45 https://t.co/8JGxhDZgMM	Sat May 19 14:15:48 +0000 2018	Toronto
997611481209294848	Dystopian Legalization Shitshow: Yukon edition. A single shop monopoly by Yukon gov to sell cannabis from the evil @CanopyGrowth is what will supply all of the Yukon. https://t.co/qQtQQNXAcL	Fri May 18 22:54:46 +0000 2018	Toronto, Ontario
997593402421071873	https://t.co/BovQPXdd6E - alcohol is a toxin, serves no medicinal benefit. With legalization of cannabis we should revisit our marketing policies on alcohol. It’s ridiculous that alcohol companies splash adverts everywhere and try to convince consumers it is safe.	Fri May 18 21:42:56 +0000 2018	toronto, ontario
997590207951245313	Top 5 opportunities for #restaurants &amp; #foodservice businesses. Who better than this industry, with its demonstrated experience in food safety and food preparation know-how, to lead the charge for the safe &amp; effective production &amp; sale of #edibles? https://t.co/3hG4pkQv7l https://t.co/SpMmflEUCv	Fri May 18 21:30:14 +0000 2018	Brampton, Ontario
997564803672502272	Waiting for the legal marijuana. I want a real Disneyland trip. https://t.co/piKQ1r9gaw	Fri May 18 19:49:17 +0000 2018	Toronto, Canada
997559140615630849	Anybody ever find a strain of weed that makes you incredibly horny? Me and court discovered a 65-35 sativa indica that doesn’t give us the munchies and about 45 min in guarantees sexy time. Amazing what access to consistently legal high quality marijuana allows for.	Fri May 18 19:26:47 +0000 2018	Toronto, Ontario
997551446408167425	Huge thank you to my colleague @BillBlair, Parliamentary Secretary to the Ministers of Justice and Health and to all #ParkHP residents who joined us last night for my Town Hall on the upcoming Cannabis Legalization! https://t.co/3QcU7K0zS9	Fri May 18 18:56:13 +0000 2018	Parkdale–High Park
997524458767310848	@giuseppelo Alcohol is a socially acceptable drug. If you haven’t yet, you will hear old-fashioned drunks badmouthing the legalization of pot which has been proven to be less prone to causing physically violent confrontations Hatred for pot is partially motivated by hatred for freedom	Fri May 18 17:08:58 +0000 2018	Parkdale–High Park
997523372786536450	Conservatives hate the other drug—the one that’s going to be legalized soon. I’ve never tried any form of it but I’ve watched as drunks have “lost their minds” and been uncharacteristically violent. Sometimes having alcoholic blackouts after acting out Legalize pot ASAP! https://t.co/1GKegsbHly	Fri May 18 17:04:39 +0000 2018	Parkdale–High Park
997287569019822080	An educational evening at the cannabis legalization townhall with @BillBlair and @viraniarif. It’s vital we get this right to be able to restrict and regulate it, to protect the residents and youth of #ParkHP #OLP #teamnadia #ONpoli https://t.co/yuZVHhstrA	Fri May 18 01:27:39 +0000 2018	Toronto
997285258096672768	@Air_Marx @KirkTousaw All I hear about is how we need to legalize and provide amnesty because pot laws disproportionately affect visible minorities.True but it’s still a small part of overall arrests in Canada regarding pot and Canadians.The victims of prohibition in Canada are largely male and white.	Fri May 18 01:18:28 +0000 2018	Toronto, Ontario
997283695089340416	Cannabis CEO: Legal weed could mean fewer prescriptions for opioids in the US https://t.co/eyOpA6K7q8	Fri May 18 01:12:16 +0000 2018	Manitoba, Canada
997253607996166144	Where is amnesty in the federal government's plan to legalize cannabis? https://t.co/ZoblxiYTMh via @georgiastraight @CannabisAmnesty #CannabisAmnesty	Thu May 17 23:12:42 +0000 2018	Toronto
997208489834491906	@RPNAS Educ day @tomkatcomm predicted “Cannabis legalization is the largest social policy change and the largest medical and scientific disruption we will see in our lifetime. “ https://t.co/bkUJEa0MHk	Thu May 17 20:13:25 +0000 2018	Toronto
997178846561558529	Attending the @YEG_Commission public meeting to hear the Edmonton Police discuss legalization of cannabis, Police plan for Edmonton &amp; listen to the Police Commission discuss police governance et al. https://t.co/lrJTf31qwT	Thu May 17 18:15:38 +0000 2018	Edmonton, Alberta, Canada
997171998290685952	Massachusetts Will Get Fewer Than 12 Dispensaries When Recreational Marijuana Legalization Begins https://t.co/aYc6PkpDUP	Thu May 17 17:48:25 +0000 2018	Vancouver, British Columbia
997170115962552320	Legal Cannabis Can’t Beat Street Dealers Without Concentrates, Senate Hears | Leafly https://t.co/bpqmaN91JR #cannabis #leafly via @Leafly	Thu May 17 17:40:56 +0000 2018	Toronto, Ontario
997136648205881344	Room full of lawyers for @lesaonline Legalization of Marijuana seminar. Each presenter should have to answer whether they've smoked and inhaled. #lesaonline https://t.co/kZ6nLWsr7n	Thu May 17 15:27:57 +0000 2018	Edmonton #yeg
997126467472388096	The NDP has consistently called for a moratorium on charging folks for simple cannabis possession pending legalization, and a proper pardon process for those convicted in the past. This is unjust and a waste of police/court resources. https://t.co/s5NSjO10zO	Thu May 17 14:47:30 +0000 2018	Vancouver Kingsway
997088057454100480	@HIBurlington for the @burlingtoncofc Legalization of Marijuana in the Workplace seminar https://t.co/JOsRGzn1jR	Thu May 17 12:14:52 +0000 2018	Canada
996939782684139520	Tonight @HamiltonLibrary “Conversations That Matter” series: Healthy &amp; Safe Communities. Insightful info on perceptions of community safety, the challenges facing 15-24 youths especially those suffering homelessness and the impacts of cannabis legalization on youth #FutureHamOnt https://t.co/TJwA3BYkCf	Thu May 17 02:25:41 +0000 2018	Hamilton, Ontario
996893613312229376	@Trader_Green @nikkihaley @USUN I have to balance my time. We are very focused up here on the top of the @JustinTrudeau agenda 1. Legalization and proliferation of pot use 2. Accelerating work permits for those marching across our unguarded borders (est is 2500 in April) 3. Screwing small business owners	Wed May 16 23:22:13 +0000 2018	Toronto, Ontario
996878995248549889	Weed is legal in Colorado :smiling_face_with_sunglasses: https://t.co/gRNAjfx41V	Wed May 16 22:24:08 +0000 2018	Montréal, Québec
996809335106953216	Workers compensation conference at the @OBAlawyers now hearing about implications of legal marijuana. https://t.co/RLAJ21EoZh	Wed May 16 17:47:19 +0000 2018	Toronto
996801602768916480	We've got a stella line-up of DPMP researchers at #issdp2018: 1) @AlisonRitter1 on the potential of broader #participation in #drugpolicy 2) @MichalaKowalski on initiation into drug #buying on #cryptomarkets 3) @MarianShanahan3 on #cannabis #legalization in #Canada (1/2)	Wed May 16 17:16:36 +0000 2018	Sydney
996769559137800193	But we will legalize pot to mix with your tobacco lol https://t.co/DdoHW132co	Wed May 16 15:09:16 +0000 2018	corner brook
996593902810365952	With all of the conferences and panels we are sitting on it is a shock that people are still confused about #acmpr #cannabis regulations and #legalization https://t.co/I4lEi14QXh	Wed May 16 03:31:16 +0000 2018	Calgary, Alberta
996552552593276928	It was a pleasure as much as it was exciting to be part of a CBC segment about Legal Medical Cannabis here in Canada. Thank you to The Home Stretch&amp; reporter Sarah Lawrynuik. @NatHealthserve @thisisTCS #CBCTheHomeStretch @cbcradio #MedicalLegalCannabis:Canada: https://t.co/m2ffvMXu7b	Wed May 16 00:46:58 +0000 2018	Calgary, Alberta
996479550455345152	@WBrettWilson Totattly agree. We provide software solutions to the Liquor industry in BC that apply to the cannabis industry. The BC govt has no idea what the potential is, nor are they prepared for legalization.	Tue May 15 19:56:53 +0000 2018	Victoria, BC, Canada
996419365519081472	I fucking love places with legal weed. Everyone is chill and I am extremely susceptible to a contact high.	Tue May 15 15:57:43 +0000 2018	Ia, R’lyeh
996312621585453056	There is no way that a married #gay #republican from #Oklahoma advocating for legalization of #cannabis, #healthcare and #Lottery #reform, a cap on government employees salary would say something like this.. I suspect a fake targeted attack. https://t.co/WxysbDVWZU https://t.co/pS2Z2AM4TV	Tue May 15 08:53:34 +0000 2018	Ottawa, Ontario
996219885184151553	@DanaLarsen @trinafraser Of which we will see as much after this atrocious Dystopian “Legalization” Shitshow “Cannabis Act” becomes law.	Tue May 15 02:45:04 +0000 2018	Toronto, Ontario
996165581865963522	Illinois is Threatening to Kill Dogs Over Marijuana Legalization #care2 https://t.co/iL7JR0Ahir	Mon May 14 23:09:17 +0000 2018	Beach, Toronto, CA🇨🇦
996163961790910464	@AndrewScheer @anna_938 Canadians voted for this atrocious government because he promised to legalize weed! Now he’s changing cannabis rules, killing thousands of jobs, ruining our economy, and taxing us to death...literally! #liberals	Mon May 14 23:02:50 +0000 2018	Canada
996142181940449281	@JustinTrudeau The vast majority of Canadians who use poppers are GAY MEN so why are you SILENT about this issue? Poppers is not dangerous it is similar to marijuana. Yet the Canadian gov. continues discriminate against GAY MEN why? Since UK made poppers legal so should CANADA!	Mon May 14 21:36:18 +0000 2018	Toronto
996141226704429057	@JustinTrudeau I think Canadian people want to see RESULTS. You said marijuana will be legal this summer yet no clear firm date this will occur. Also, my complaint is I don't like the Canadian gov. legislating morality or preaching to adults. Canadians should own more than 4 pot plants.	Mon May 14 21:32:30 +0000 2018	Toronto
996069444072849408	@DanaLarsen @AndrewScheer Yes Dana, because the average Canadian family is unfairly burdened with taxes on marijuana. And legal marijuana retailers are hurting. Not that any of them sell 100% their product legally...	Mon May 14 16:47:16 +0000 2018	Coquitlam, BC Canada
996050868079296512	@Andy_Staples Won't change my life one bit. Same thing with smoking weed - never have and never will even if it's legal everywhere.	Mon May 14 15:33:27 +0000 2018	Charlotte, NC
996046437812092928	Give Lesbian Art Teacher Her Job Back #care2 https://t.co/sXgSTeZAba	Mon May 14 15:15:51 +0000 2018	New York, USA
995975265259081728	i'm the new black market blood charts by colour and Brazilian medication also street penniciline to fix a sezure and white goddess cannabis probably never legal works to get off drugs the program adva Valnal and mexadone	Mon May 14 10:33:02 +0000 2018	Truro, Nova Scotia
995896842922573824	weed being mostly legal in canada and the vents in this airbnb means the guy downstairs has p much hotboxed us	Mon May 14 05:21:24 +0000 2018	🏴󠁧󠁢󠁳󠁣󠁴󠁿
995744224405438466	good thing I'm over 30 but still. is this because of weed legalization?	Sun May 13 19:14:57 +0000 2018	montreal, qc
995657184267591681	Big pharma has had the time and resources to create a near-perfect supply chain model - and legal cannabis producers should be trying to emulate it. https://t.co/ovdILSEaEJ #pharma #THC #cannabis #medicalcannabis #cannaresearch #cannabisindustry #supplychain #ACMPR	Sun May 13 13:29:05 +0000 2018	Canada
995642193548197888	@TeamPro1 @twinklestarblue @CityofBrantford Excuse me but isn’t tabaco also legal however, there restrictions on where you can smoke it. Same thing should apply to marijuana. Is not about feelings, is about respect towards others.	Sun May 13 12:29:31 +0000 2018	Brantford, Ontario
995553872541138944	Conservative staffer fired after urging senators to delay vote on marijuana legalization bill https://t.co/owS26UhUqu via @torontostar	Sun May 13 06:38:34 +0000 2018	Sylvan Lake, Alberta
995529632827899904	@Oh_Canada2017 @twinklestarblue @CityofBrantford 1) I’m not a pot smoker 2) crazy to think people going to show up out of the blue to a random park to smoke weed that aren’t already smoking weed there 3) if it’s LEGAL we shouldn’t force people to a few locations 4) someone’s feelings are not as important as the law #democracy	Sun May 13 05:02:15 +0000 2018	Sylvan Lake, Alberta
995493248218140672	@BobRae48 Autocracy, plutocracy, theocracy, oligarchy and dictatorships seem to be the norm everywhere we look. Sad. Even in America and Canada :Canada: we make :banana: republics look good. Sad. Bread &amp; circuses divert attention; sports the opium of the people; legal pot will keep us high &amp; docile	Sun May 13 02:37:40 +0000 2018	Waterfront , Toronto, Ontario
995356311775662080	Tory staffer fired for urging senators to delay final vote on pot legalization https://t.co/TxEisMLx9K	Sat May 12 17:33:32 +0000 2018	ÜT: 54.161035,-113.744424
995328435256995841	@PhillyD your for the legalization of marijuana so I unsubscribed and re-subscribed to your you tube channel because you content is gold and if I agree with you or not (in this case I do) I love what you do phill	Sat May 12 15:42:45 +0000 2018	ontario
995300810715291649	@plantedinspace Excited for your adventure!! I got to enjoy so much legal weed in Cali. It’s great :smiling_face_with_heart-eyes::leaf_fluttering_in_wind:	Sat May 12 13:52:59 +0000 2018	she/they
995206967395155968	@DanaLarsen @JustinTrudeau @jjhorgan @DarcyJudy @sarahblyth Senators delaying pot legalization to score a few cheap #cdnpoli points w/for fringe of ultracon voters should rot in Hell sevenfold their frivolous phony delays. Are they blind to real-world big picture? Or knowing monkey-wrenchers? Either way they don't deserve appointd office.	Sat May 12 07:40:05 +0000 2018	Campbell River
995169052279656448	“Even in 2018, most so-called cannabis enthusiasts are not walking around in suits, poloshirts &amp; $42 haircuts, like some of the legalization campaigns attempt to portray. The scene is still full of regular, working-class people, who wear jeans &amp; t-shirts &amp; like to catch a buzz” https://t.co/UpQ4uIovnd	Sat May 12 05:09:26 +0000 2018	kensington market, toronto
995055977006227457	Are you ready for our Provocative Panel? Marijuana Legal for Adults: Is Marijuana Useful and Ok in Children? At the 5th ACH Paediatric Update Panel https://t.co/3moMBaWR7E	Fri May 11 21:40:06 +0000 2018	Calgary, AB
995031609198821377	@CBCAlerts #CanadianSensate #Weed I have a resolution to this problem. Dissolve the Senate once and for all!!! Most of those old senile space takers are higher on the legal medications; than those who some some weed.. Mix that with dementia and you have a real recipe for disaster.	Fri May 11 20:03:17 +0000 2018	Toronto, Ontario
995013426454908928	This is my problem with the rationale "legalize pot and tax the shit out of it." This completely ignores the fact that cannabis helps a lot of people with pain and other conditions. Fuck the money. Greedy bastards. https://t.co/FSh7ioGysE	Fri May 11 18:51:01 +0000 2018	Canada
995002824919416833	@iainlovatt The really going to waste tax dollars to catch my grow op when weed is going to be legal in a couple months? Lol	Fri May 11 18:08:54 +0000 2018	Greater Toronto Area
994982843125325824	@OREAinfo has submitted its Five Point Plan for Cannabis Legalization to ensure that both home owners and REALTORS:registered: are protected from any issues that may arise from legal and illegal cannabis grow operations. Take a look at it here: https://t.co/FX7hYl0J1c #protectONhomes https://t.co/B52JTa8yYC	Fri May 11 16:49:30 +0000 2018	Ontario, Canada
994701825331769344	@dinnerwithjulie That pot shouldn't be legal.	Thu May 10 22:12:50 +0000 2018	Calgary, Alberta, Canada
994668139592933380	@irishrygirl And hemp can do wonderful things too. I’ve never partaken of marijuana but am fully behind legalization. There’s just too much evidence of medical benefits. #bigpharmacriminals	Thu May 10 19:58:59 +0000 2018	Vancouver BC
994662908863934465	It is time to take action #Canada-#legalization &amp; #regulation and #safeaccess of all #drugs will end the most black market #fentanyl. Start tapping into healthier alternatives like #Cannabis or #Kratom and let’s start #HEALING #addicts instead of watching us die! #overdosecrisis https://t.co/MzBsQaQSXR	Thu May 10 19:38:12 +0000 2018	Brockville, Ontario
994661436444966912	@DanaLarsen What do you think of the Senate foot-dragging on legalization of cannabis? IMO they have zero respect for public opinion and the superiority of the elected chamber. Too bad irresponsible Senators can't be fired.	Thu May 10 19:32:21 +0000 2018	Campbell River
994659796732301312	So I was trying to find the legalization date for cannabis... https://t.co/6vn172D8zs	Thu May 10 19:25:50 +0000 2018	Campbell River
994646946362023936	#CPC freaking out #cannabis will be legal before #C46 (dealing with impairment) is given Royal Assent. The current laws around impairment will still exist, therefore even when cannabis is legal, driving while impaired still won’t be. Not rocket science @CPC_HQ. #cdnpoli #hw	Thu May 10 18:34:46 +0000 2018	Calgary #yyc #yyccentre
994631197794816001	@Penny_Green Have to say your last name is perfect to write about the pending legalization of pot! You could do a weekly column. #GreenReport #Justsaying ;)	Thu May 10 17:32:11 +0000 2018	Edmonton, Alberta, Canada
994604456800079872	@bcbluecon I agree. Legal possession means home grown pot will be uncontrollable as will be cheaper black market pot. It’s basically open season.	Thu May 10 15:45:56 +0000 2018	Port Elgin, Ontario, Canada
994603830615658496	@amandacconn So did he just suggest that Canadians should like about smoking pot even though it might be legal here?	Thu May 10 15:43:26 +0000 2018	Toronto Area -  Westside BMO
994603251579412481	Davies asked Goodale whether there's any deal so that Cdns won't be barred at US border for admitting smoking pot once legal. Goodale: "You should not engage in behaviour that would provoke or prompt an American border officer to be suspicious of your behaviour."	Thu May 10 15:41:08 +0000 2018	Ottawa, ON
