id	text	creation_time	user_loc
1046194180018655232	#weed is going to be #legal in 18 more days! #puffpuffpass by #thedragon to check out our #glassforsale - #sales on (almost) #everything #smokeweedeveryday #smokeweed #weedstagram420… https://t.co/TWp82O2f2E	Sun Sep 30 00:25:04 +0000 2018	Toronto, Ontario
1046163115082207232	@weed_canada No, it isn't. This isn't anything CLOSE to legal. This is just a change as to WHICH criminal gangs will be profiting off of Canadians.	Sat Sep 29 22:21:38 +0000 2018	Toronto, Ontario
1046110092742070273	@KEANS07 @DaggaCouple @IOL No rehabs believe that cannabis is a gateway drug. Courts and legal systems still believe it is a gateway drug. Rehabs just believe that pot smokers are easy to care for, and thirty grand for a month is pretty good money.	Sat Sep 29 18:50:56 +0000 2018	Toronto, Ontario
1046065691953176578	Scheer on his climate plan, supply management, and the push towards legal pot https://t.co/2cvFHZhnWp Scheer has no climate change plan. He and his party believe climate change is a hoax. @LorneNystrom @PattyOLimerick	Sat Sep 29 15:54:30 +0000 2018	Toronto, Ontario
1046059061433815046	Lol yeah! Goodluck, weed is legal so now we have to dodge both tobacco and ‘ igbo’ in public spaces https://t.co/JZPLfZT3Ky	Sat Sep 29 15:28:09 +0000 2018	Ontario, Canada
1046021267772530689	Cheap beer. Check. Legal Weed. Check. Sweet rides. Check. https://t.co/R9kLyvEv6q	Sat Sep 29 12:57:59 +0000 2018	Royal York Plaza
1045977009208348673	They've got a guy...well, more than one, to be exact: YG secures more suppliers ahead of looming Oct. 17 date for marijuana legalization. Read in @WhitehorseStar https://t.co/OPqs7Ulf2H	Sat Sep 29 10:02:06 +0000 2018	Whitehorse, Yukon
1045974664948985857	With the full legalization of marijuana in Canada, Ontario has clarified that in this province weed can be smoked anywhere tobacco can. One can stroll down the street sparked up. I don’t use marijuana but I agree with this. Actually, I think it’s still too restrictive.	Sat Sep 29 09:52:48 +0000 2018	Toronto New York London
1045870907179380737	@kobboss Almost every other reporter had just asked him about pot rules post legalization. I asked him a question at the event pertaining to Drive Clean. That’s the context.	Sat Sep 29 03:00:30 +0000 2018	Toronto via Calgary
1045865670640951297	@classified when you think Legal Marijuana video will be up? Can’t wait to hear new songs!	Sat Sep 29 02:39:41 +0000 2018	Keswick, Ontario
1045863116335173633	Marijuana will be legal in Canada in less than a month — and the details around pot shop ownership in Regina are still hazy. https://t.co/LmvojVMhKh	Sat Sep 29 02:29:32 +0000 2018	Regina, SK
1045848501433716736	Some #cannabis companies turning to temporary foreign worker program ahead of legalization @VanmalaS https://t.co/BJWFPP1EfE	Sat Sep 29 01:31:28 +0000 2018	Canada
1045848451978792960	Canada :Canada: cannabis legalization embraced at the federal level and resisted by cities. USA :United_States: cannabis legalization resisted at federal level embraced by cities.	Sat Sep 29 01:31:16 +0000 2018	Toronto
1045842795796152320	A little over 19 days until weed is legal. Not sure if the story that day will be about the size of the line ups or the disguises people in line wear. Pretty sure it won't be about governments that privately cheer the revenue it creates but publicly raise nothing but concerns	Sat Sep 29 01:08:47 +0000 2018	Regina, Saskatchewan
1045814889036443649	My work Quickgrow Kelowna is hosting a massive event on October 17th for the legalization of marijuana, and Tommy fuckin Chong is gonna be there, gonna be nuts. Pop in.	Fri Sep 28 23:17:54 +0000 2018	Regina, Saskatchewan
1045805761480146944	The Cannabjs Legalization Panel: Province by Province break down of cannabis laws. @KirkTousaw Andrew Gordon @DanaLarsen https://t.co/BS7BihIsI3	Fri Sep 28 22:41:38 +0000 2018	Vancouver, British Columbia
1045793250198663168	Since growing cannabis in the apartment will be legal and because it is a plant if I am growing marijuana in my place actually then I would be a florist, right?	Fri Sep 28 21:51:55 +0000 2018	Toronto
1045787799570587650	Such a #dynamic #panel about #cannabis #legalization at @Cannahempconf @ Chan Center UBC https://t.co/QUUndrHHLC	Fri Sep 28 21:30:15 +0000 2018	vancouver/ toronto
1045779422068924416	Wrapped up a 2-day workshop on the legalization of cannabis within FN communities. Lots of information I’m bringing back and going to be presenting in front of C&amp;C. Thanks @ThunderbirdPF for an eventful and educational workshop #cannabiscanada https://t.co/uIMeJzvBlZ	Fri Sep 28 20:56:58 +0000 2018	Standoff AB
1045765687380127744	I met with this group of NE #yyc residents yesterday: Some people in northeast Calgary appealing to keep cannabis stores out of family neighbourhoods | CBC News https://t.co/IahdWVJZy6 #neyyc #yycc	Fri Sep 28 20:02:23 +0000 2018	Calgary, AB, Canada
1045755377722089472	The framework for legalization of cannabis in Canada had many consulting experts, but no occupational health or addictions medicine consultants https://t.co/g1J9pr2FZ1	Fri Sep 28 19:21:25 +0000 2018	British Columbia, Canada
1045745546802155520	Cannabis legalization is coming...what does it mean for your business? Join us Oct. 18th in Moncton @Venn_Innovation for an informative session and online course to prepare your business &amp; your workforce, brought to you by @ACADA_Atlantic and @SayleGroup https://t.co/IeagqMwZUs https://t.co/eSq68p3HqR	Fri Sep 28 18:42:22 +0000 2018	Atlantic Canada
1045745169830739969	One hour into a lecture about optimization, the professor is talking about Newton’s method, and he pauses abruptly while writing something on the board, “What day does pot become legal btw?” Hahaha :face_with_tears_of_joy: #MachineLearning #GradSchool	Fri Sep 28 18:40:52 +0000 2018	Montréal, Québec
1045729170444210176	@valentino_nora @thesmacleodshow @HfxRegPolice @SteveCraig4HRM Or alcohol (on the job). This issue is re their off duty personal time. Will marijuana &amp; alcohol be treated differently off duty? Both legal. #Halifax	Fri Sep 28 17:37:17 +0000 2018	Halifax, Nova Scotia
1045710244981215232	October 17th is gonna be a hell of a day in Toronto :man_gesturing_OK_medium_skin_tone::smirking_face::beaming_face_with_smiling_eyes: • • • • • #Toronto #torontobud #torontostoners #420 #1017 #itslit #potsmokers #cannabis #weeddaily #smokers #legalization… https://t.co/JshDW2OlJk	Fri Sep 28 16:22:05 +0000 2018	Broward County, FL
1045708047593566209	What do you get when you combine the legal cannabis industry with CBD, a cannabis compound that treats pain but doesn’t get users high? @IrisDorbian https://t.co/DXgwrJ1uoV	Fri Sep 28 16:13:21 +0000 2018	Canada
1045661671899820033	Oh neato, I’m up for an award! Cannabis Influencer. Honoured to be even mentioned with the other nominees! Thx @liftandco @thisisTCS @NatHealthserve #cannabiseducation #legalization #liftawards #cannabis #stopthestygma #medicalcannabis #cannabiscommunity :Canada::victory_hand_medium-light_skin_tone::seedling: https://t.co/M3Nu1D7ICu	Fri Sep 28 13:09:04 +0000 2018	Calgary, Alberta
1045651048306593792	Speeding in residential neighbourhoods, the legalization of cannabis-lots to talk about with @PtboPolice @Chief_SGilbert on The Morning Show on @CHEXNewswatch	Fri Sep 28 12:26:51 +0000 2018	Calgary, Alberta
1045645433891115008	Has Nunavut signed a cannabis supply agreement yet with any LPs? Reviewing supply agreements held by all major growers and I see no mention of Nunavut. Will there be an online portal on October 17? How will Nunavummiut access legal cannabis next month?	Fri Sep 28 12:04:33 +0000 2018	Iqaluit, Nunavut
1045629988656087040	@RootsReggaeHub @MzansiReggae @VLScully @108praiseradio And don’t forget about Canada, an entire country is moving to legal cannabis, with its provincial governments as the primary distributor, in less than 3 weeks! #CannabisAct #LegalizeIt	Fri Sep 28 11:03:10 +0000 2018	Head of St. Marg's Bay, NS
1045541498970951680	@aziz_emran If I’m understanding this story correctly, a small amount of cannabis was found in a school parking lot, and no children were harmed or came in contact? Is cannabis decriminalized or legal there?	Fri Sep 28 05:11:33 +0000 2018	Milton, Ontario
1045526409664315392	@JustinTrudeau @UN How about signing on tonTrumps renewal of the war on drugs? It is a contradiction of your own government policies, such as cannabis legalization, against evidence and a slap in the face of grieving families. #MSTH https://t.co/hyTMCkJeiF	Fri Sep 28 04:11:35 +0000 2018	Edmonton, Alberta
1045514902389968902	With a high school bound son, I am so worried about the legalization of #marijuana and the effect it would have on tweens. More to worry about besides alcohol and smoking. https://t.co/d93ml1gJOM	Fri Sep 28 03:25:52 +0000 2018	Edmonton, Alberta
1045489121643384837	Loving My New Healthy Portable Vaporizer better for the Lungs and Heart! Staying on top of Pain Management just got a lot easier! Just in time as Cannabis becomes legal too!… https://t.co/jJWfd6tjCP	Fri Sep 28 01:43:25 +0000 2018	Edmonton, Alberta
1045467088616386560	@Sarahharnum Going Rasta for legal weed day are you? :rolling_on_the_floor_laughing::rolling_on_the_floor_laughing::rolling_on_the_floor_laughing: jk	Fri Sep 28 00:15:52 +0000 2018	Stephenville,  NL
1045445957121429505	@dankojones Make sure it’s done and wrapped up for when pot is legal so you can sell it in Marijuana stores and pair with a half graham of weed, think of the record sales.	Thu Sep 27 22:51:54 +0000 2018	Ontario, Canada
1045418265021796352	By this time next month, marijuana will be legal in Canada.:thinking_face::thinking_face::thinking_face: Winter + marijuana = ...?	Thu Sep 27 21:01:51 +0000 2018	Lagos.
1045400681853607936	So many questions... pot legalization countdown. #comedylife #potlegalization #marijuanadispensary #ishedancing #thewindguyishighAF @ Ottawa, Ontario https://t.co/V77ecaYss3	Thu Sep 27 19:51:59 +0000 2018	Long Beach, CA
1045392069345210368	For good reason, there’s a lot of interest in tracking #marijuana use trends in the era of legalization, especially as it concerns youth consumption. @kylejaeger https://t.co/NpB663Regs	Thu Sep 27 19:17:46 +0000 2018	Canada
1045380508627030016	Premier @RachelNotley says the upfront funding for communities in regards to cannabis will roll out over the next couple of weeks, in time for legalization on October 17th. #ABLeg	Thu Sep 27 18:31:50 +0000 2018	Red Deer, Alberta
1045377614070734849	@akarndt Yep. Growing is a valid safety issue. Smoking? Pretty sure that’s been going on for years. Buying and selling? This has been settled by federal legislation and the provincial framework. Does Boardwalk intend to punish tenants who have legal weed delivered, medicInal or otherwise?	Thu Sep 27 18:20:20 +0000 2018	Calgary
1045372168593260544	Attending the Regional Cannabis Dialogue at River Cree. Lots of discussion in FN communities with the legalization approaching. #cannabis https://t.co/6TzETDDZz7	Thu Sep 27 17:58:41 +0000 2018	Standoff AB
1045364098513305600	I Want Marijuana To Be Not Legal And Just Be Illegal Because Marijuana Shouldn't Be Allowed In Any Country In The World. ! ? Marijuana Shouldn't Be Smoked,Drinked And Eaten. ! ?	Thu Sep 27 17:26:37 +0000 2018	Mississauga,Ontario
1045341924444590080	the unofficial :woman_fairy_medium_skin_tone:FAIRY:woman_fairy_medium_skin_tone: godmother of women &amp; weed is dusting #winnipeg this week - stop #1 as vanderpop tours Canada in support of FEDERAL ADULT USE LEGALIZATION ON OCT 17.… https://t.co/dKxRTpAHt0	Thu Sep 27 15:58:30 +0000 2018	SEATTLE
1045335687841513472	Minister Anderson also states “Announcement to come in the next couple weeks about funding for Municipalities who will be impacted by the legalization of cannabis”. https://t.co/rVNdXLuaUm	Thu Sep 27 15:33:44 +0000 2018	Fort Saskatchewan
1045318781818589184	yooooooooo I hate the progressive conservatives but they are handling this legal weed situation perfectly	Thu Sep 27 14:26:33 +0000 2018	toronto
1045311438632284160	Boardwalk won't be allowing cabbabis in its properties once recreational marijuana becomes legal next month https://t.co/6glVBdSIrE #gpab #countyofgp https://t.co/djCh1TBXN2	Thu Sep 27 13:57:22 +0000 2018	Grande Prairie, Alberta
1045292646778920960	I have yet to comprehend people’s frustration over the legalization of marijuana. It frustrates me the lack of knowledge people have to the benefits of cannabis use.	Thu Sep 27 12:42:42 +0000 2018	Grande Prairie, Alberta
1045277578536398853	@aziz_emran Understood. It is happening though, and cannabis is much safer than many legal drugs, I assure you.	Thu Sep 27 11:42:49 +0000 2018	Milton, Ontario
1045275897849352195	@aziz_emran It does. I’m referring to legal cannabis for adults, though. Still illegal for youth.	Thu Sep 27 11:36:08 +0000 2018	Milton, Ontario
1045270392292757505	Ontario gov’t to introduce legislation today about how it’s all going to go down Oct. 17 when pot becomes legal. Yesterday, @fordnation announced you’ll be able to smoke rec. pot wherever tobacco is smoked. Thoughts? Tweet me. #onpoli #cannabis @morninglive https://t.co/PCoiHC30hp	Thu Sep 27 11:14:16 +0000 2018	Toronto/Hamilton
1045267039181516800	@clairlemon They opposed military action in Iraq, want prison reform, are pro gay marriage and marijuana legalization Unsure how that's to be viewed as a negative. If anything "conservatives" should be saying those things.	Thu Sep 27 11:00:56 +0000 2018	America's Hat©
1045243991409680385	A lot of our fuzzy feelings toward legalization may be based on hazy memories of decades past. @fffmarchand #cannabis https://t.co/1ZqEZ8e9lg	Thu Sep 27 09:29:21 +0000 2018	Canada
1045221739884466176	Legalization woes from @C_Mulroney on #Cannabis in Ontario. #Cannabis #Marijuana #onpoli #Thread on presser from @ManishaKrishnan https://t.co/ecyp1jtYiN	Thu Sep 27 08:00:56 +0000 2018	Canada
1045197081852272640	What makes you think the dude who gets texted for pot won't continue that illegal revenue stream while opening legal shop? https://t.co/UnHE3El5UC	Thu Sep 27 06:22:57 +0000 2018	GTA, Ontario, Canada
1045144590716555264	@bitcoinbroke Hi there! Unfortunately we cannot extend our CCC positions outside of Canada due to the extensive legal issues around cannabis. However, we hope you stay connected with us through our social channels. You never know, maybe we’ll be able to go international one day :)	Thu Sep 27 02:54:22 +0000 2018	Canada
1045144294871437312	I’m really nervous about cannabis becoming legalised in Canada. It’s going to be legal to smoke that crap on the streets, it’s disgusting. The smell literally knocks me sick.	Thu Sep 27 02:53:12 +0000 2018	Toronto, Ontario
1045142916476284928	@CBCQueensPark @RuthRogul Make pot legal they said Think of the tax revenue they said It’ll be cool they said Everyone’s doing it they said What could go wrong they said :neutral_face:	Thu Sep 27 02:47:43 +0000 2018	Powassan, Ontario
1045137224965050368	Honoured to have @DeanPilling_MME from @calgaryherald report from today’s media tour - “We do not use any automation,” [Master grower Bill Vasilakakos] says. “Everything is done by hand — we stay very intimate to our plants right to the end.” https://t.co/MXqOtD3wjw	Thu Sep 27 02:25:06 +0000 2018	Calgary, Alberta
1045110869493919744	@l_stone @RobertFife Good thing cannabis will be legal soon. You’ll need it after dealing with that circus shitshow.	Thu Sep 27 00:40:23 +0000 2018	Calgary #yyc #yyccentre
1045101084862304256	@marykkeown @BillCrumplin @GreaterSudbury Huh? I thought marijuana wasn't legal until October 17th.?	Thu Sep 27 00:01:30 +0000 2018	Garson, Ontario, Canada
1045097535520542720	Did Ed Holder just imply that with the legalization of marijuana that our police will have more work cut out for them? I’m confused if so. #Ldnont #Ldnvotes :thinking_face:	Wed Sep 26 23:47:24 +0000 2018	London, ON
1045096271642537984	If cannabis is legal this will stop. Synthetics is similar to bath tub gin during prohibition. Clean up the drug supply and fewer people get poisoned. @CAMHnews @camhedu @endstigma https://t.co/RWbm4tqid8	Wed Sep 26 23:42:22 +0000 2018	CAMH / UTORONTO
1045080625474990080	@lilbitliberal @BillyArmagh @reecenoland @NikaDragomira Legalization of weed for example creates multiple new criminal offenses, consumption of weed is mostly limited to people who live in and own single family homes. It's just commodification. And yesterday he agreed to double down on the war on drugs. He's Harper with a smile.	Wed Sep 26 22:40:12 +0000 2018	Connaught, Calgary
1045059987779641344	Rental giant Boardwalk bans all #cannabis use from its properties | CBC News https://t.co/9ppImHas49	Wed Sep 26 21:18:12 +0000 2018	Canada
1045057230297608193	@JustinTrudeau you have done nothing during your term, other than legalize pot! #TrudeauTotalDisappointment	Wed Sep 26 21:07:14 +0000 2018	Canada
1045051914730098688	“Canada has moved to legal regulation of cannabis knowing that a strict interpretation of the current international drug compliance system would see it non-compliant." said Ms Clark former PM of New Zealand re: Canada’s signing to renew the international war on drug.	Wed Sep 26 20:46:07 +0000 2018	Kelowna, British Columbia
1045051673863905280	The War on Weed won’t end with legalization. https://t.co/gHtshhLxxe	Wed Sep 26 20:45:09 +0000 2018	Saskatchewan
1045036710784954369	@mikesbloggity Legalization was actually just commodification. There are more criminal offenses on the books for weed after than before legalization. Only a minority of the population will be able to legally consume cannabis. In so many ways this is worse than before.	Wed Sep 26 19:45:42 +0000 2018	Connaught, Calgary
1045011183068041217	@42WildFlowerz @JustinTrudeau The courts have been the source of virtually all legal progress the cannabis community has made since the 90s. Parker. Hitzig. Smith. Allard. All court decisions that dramatically advanced rights and the cause of cannabis access.	Wed Sep 26 18:04:16 +0000 2018	Victoria BC
1045008602111520768	@mariamdena I was thinking this after I heard it on the radio.. “Canada where cannabis is now legal .. except you can’t ingest it... anywhere”	Wed Sep 26 17:54:00 +0000 2018	Alberta, Canada
1044991795057180672	@BeachGlassFan @BannockHammock I hope they do a much better job than that. The legal weed bill creates a bunch of new criminal offenses and just yesterday JT doubled down on the war on drugs.	Wed Sep 26 16:47:13 +0000 2018	Connaught, Calgary
1044984116486098944	Public outrage over a death penalty handed to a 29-year-old man is spurring #Malaysia to start talks to legalize #marijuana for medical use, racing to become the first Asian country to do so. cc @weinay @RevaSeth https://t.co/hLawNx9Seg	Wed Sep 26 16:16:42 +0000 2018	Canada
1044970773918576640	I’ll be getting reaction to this from a legalization anylist and a long time pot advocate. What will Ontario’s cannabis framework mean for you?... https://t.co/PYsBgOwDWZ	Wed Sep 26 15:23:41 +0000 2018	Toronto
1044962279362629632	Despite weed about to become completely legal here in Canada in less than a month, one of the main complaints I still hear about it is the smell Would it be possible to cultivate a scentless or reduced event) even when burned) marijuana that would still retain its effectiveness?	Wed Sep 26 14:49:56 +0000 2018	The Place Between Worlds
1044961208049197058	@WillemsenRyan @BradleySumner @nationalpost @fpcomment You mean legalization? Replacing 7 cannabis laws with 45? Or the extra half a billion in policing said legalization? Hardly a success.	Wed Sep 26 14:45:41 +0000 2018	Vancouver, British Columbia
1044945261762498562	Tempering the Okanagan cannabis legalization ‘gold rush’ https://t.co/4gI6cfXEn6	Wed Sep 26 13:42:19 +0000 2018	Vancouver, British Columbia
1044937266819465216	Happy Wednesday! Joining the dream team now talking #ttc #pot legalization @AirCanada #CosbySentencing and more! @jerryagar1010 @retrontario + Zoltan Horcsok ! https://t.co/u8hbFyprxP	Wed Sep 26 13:10:33 +0000 2018	Toronto, Ontario
1044925921638174724	The #research is suggesting that, actually, behaviour by individuals is not going to change in a material way after « legalization » occurs." #cannabis #ubc #university #commonSense https://t.co/Sv7pln7IUn	Wed Sep 26 12:25:28 +0000 2018	Québec, Canada
1044896311215091712	#Black communities press for amnesty as pot legalization nears https://t.co/lxpph6h2B0	Wed Sep 26 10:27:48 +0000 2018	Toronto
1044842011474481157	https://t.co/aKclV5NOCf To pardon everybody for cannabis possession offenses would be the state recognizing that prohibition was a mistake. It was and is a mistake. Pardon people and let them get on with their lives. #cdnpoli	Wed Sep 26 06:52:02 +0000 2018	Toronto, Ontario, Canada
1044831793533382657	It seems like people just want legal marijuana instead of a better economy https://t.co/CjHGuffxy8	Wed Sep 26 06:11:26 +0000 2018	////AMG driver
1044825367406628864	@LeonaAlleslev Hi Leona. I would have left because Justin Trudeau isn't a good leader. He was in New York today. Canada signed an agreement with U.S. on the "War on drugs" This, when we're about to bring legalization of cannabis. How serious is Canada in this agreement. It	Wed Sep 26 05:45:54 +0000 2018	Toronto, Ontario
1044823695687143424	@AndrewScheer Hi. You may want to ask the PM about this. As you know, the legalization of cannabis, so, why did Canada sign an agreement with :United_States: to deal with the "war on drugs?" Isn't this a conflict of interest? Justin Trudeau is not acting too smart.	Wed Sep 26 05:39:15 +0000 2018	Toronto, Ontario
1044822224912482304	@globeandmail I agree with this. This is a conflict of interest. You don't declare a war on drugs just before the legalization of marijuana. You can't be taking this agreement serious. He doesn't really understand.	Wed Sep 26 05:33:24 +0000 2018	Toronto, Ontario
1044806336368791554	@gillrh Drunk? Is that what they are? Then it's really going to be party time for them when pot is legal and growing in the back yard. (Not mine, obviously.)	Wed Sep 26 04:30:16 +0000 2018	Toronto, Ontario
1044757274118377472	Quesnel will not allow public cannabis smoking or private cannabis retailers #cannabis #legalization #cbc https://t.co/6UslLMQXNR	Wed Sep 26 01:15:19 +0000 2018	Vancouver, British Columbia
1044755779658477568	@ChaseRuttig This would have made a great tale for The Vinyl Cafe : “Oh, ya know Ted, it’s nothin to do with you. Morley and I like you and Polly. We just gotta get our weed the legal way now. I hope ya understand. Now let’s go and enjoy one of Kenny Wong’s meat pies.”	Wed Sep 26 01:09:23 +0000 2018	Calgary, Alberta
1044754039844438017	This might be the most creative thing written about #cannabis legalization to date. https://t.co/zXWESkefQo	Wed Sep 26 01:02:28 +0000 2018	Calgary, Alberta
1044752379864768512	“Between pot legalization, the rapid expansion of supervised-injection sites &amp; increased access to the opioid antidote naloxone, the federal gov’t has focused overwhelmingly on harm reduction.” And yet, more people will die this year than ever before. https://t.co/NsmuCRiaE5	Wed Sep 26 00:55:52 +0000 2018	Toronto / Mouseland
1044735100791939072	@lisa67392 @JustinTrudeau @IvanDuque Good thing pot will be legal soon. Lol thanks for your input.	Tue Sep 25 23:47:12 +0000 2018	Toronto / Mouseland
1044728462873751552	I don’t understand how Trudeau can legalize pot out of one side of his mouth and then cosign this garbage out of the other. I mean I do, don’t @ me, but I’m still pissed off about it. https://t.co/UdLlz7I1hq	Tue Sep 25 23:20:50 +0000 2018	New Westminster, Canada
1044722433926868992	“Cannabis legislation has been rammed through across the country and despite many unanswered questions, legalization is almost upon us,” “Nova Scotia municipalities should not have to bear financial burden of policing this new legislation.” https://t.co/3kpGFybyK2	Tue Sep 25 22:56:52 +0000 2018	Halifax, Nova Scotia
1044712182842241026	@IanHartley_ @KathieDavid What does that mean? Gosh, you must be happy pot will be legal in Canada soon so your can live with Alice in Wonderland with the mad hatter!	Tue Sep 25 22:16:08 +0000 2018	Western Canada
1044711719220711424	Reports being presented tonight include an update on the 2019 budget, a recommendation for a transit smart card fare system, and an update on how legal pot is expected to impact city programs and services. #SUDpoli @CTVNorthernNews	Tue Sep 25 22:14:18 +0000 2018	Sudbury 🇨🇦
1044706499195555840	@kinsellawarren @jen_keesmaat I’m not sure of the context, but banning legal handguns to keep hand guns out of the hands of criminals will be as successful as making pot, cocaine or other street drugs illegal. You will have better success pissing into the wind.	Tue Sep 25 21:53:33 +0000 2018	Toronto, Ontario
1044678634143920128	The Beaverton - Canada promises to regulate legal cannabis with same fairness and efficiency as telecommunications https://t.co/7MYKdRFy5I	Tue Sep 25 20:02:50 +0000 2018	Montréal, Québec
1044670657127043072	@theJagmeetSingh The "war on drugs" led by the US is an archaic approach/doesnt work. Canada knows better trudeau does not. Were the 2nd country in the world 2 legalize pot. Ur going 2 let trump bully us? We can b world leader instead we're following trump policies no less. @JustinTrudeau	Tue Sep 25 19:31:08 +0000 2018	a beautiful island in BC
